Tweet,label_encoded
mondol kamar orangngirit masak rameada bawa pancikompordandangberas kurang enakbanyakin micin,4
suka banget kalau sudah foto sama kamerea,3
aduhh tolol ceplos,0
introvert tidak sama malu takut sosialisasi introvert sama seperti orang umum sosialisasi tidak sulit mereka cuma sosialisasi uras energy,4
ingat korupsi kenal hari libur makan gizi gratis tetap jalan meski libur sekolah badan gizi nasional bangun pasti program makan gizi gratis mbg tetap jalan libur sekolah,0
masuk skuad barcelona liga europa dan alves kecewa berat bolanet arenanews,5
pantesan banyak,5
tidak makan apa nder sedih,5
apa semangat,4
korupsi akan pernah hilang kita benci koruptor bukan korupsi salah satu masalah besar bangsa adalah perilaku koruptif sudah akar jadi macam budaya jangan sama koruptor budayawan hanya umpama,5
tren viral media sosial begini kronologi muncul gema media sosial hingga viral bentuk kritik bijak perintah,4
ngeri keinjek nya min,1
menteri ketenagakerjaan menaker yassierli pandang adalah buah kritik perintah kait lapang kerja tanah air,4
yaallah kabar baik bismillah yaallah jalan,2
kejer panik takut bakar dormnya,1
seringsering bikin taeyong yaakk seruu semangat teruss nob,2
bahagia bukan arti segala sempurna bahagia ketika kamu putus tuk lihat segala cara sempurna,4
tambah korupsi bodoh uang halal makan yang haram,0
bekas sekretaris sama nurhadi baru kejap hirup udara bebas langsung tangkap oleh komisi berantas korupsi hal jadi,4
bodoh santai sendiri sakit,0
bismillahtetap semangat jangan menyerahyakin bigwin,2
suka tidak apa boleh blah harap sudah penuh tolong kau minta baik terima kasih,3
punya lebih pirasat mungkin betul,4
malu saya diapain mer wkwk dibalikin tes detak jantung saja kali saya beneran degan soal tetap ada ubah cuma emang tau sih kalau dipretelin tettep takut,1
akhir tidak malu soal bener,4
laku bodoh awak gembira lihat awak jaya bodoh tapi jujur tidak bodoh awak know the benar kamu did,4
aib bodoh benar kata aib muncul lebih sudah tindak keji jangan kau sembunyi cara telaah masalah misal anak perempuan tempeleng apa kau tuju dia sikap bungkam lapor polisi adl benar lantas apa beda,0
grammar topik tema biar nulis tata bahasa ngasal lagi tema grammar contoh soal kunci jawab original siap jadi senjata ajar stok batas sesal,4
aaaaaa senang banget micchi riko satu film entah pas nonton kiekoi saya suka banget kalau dua satu scene,3
semangat jangan lupa sarap,2
saad ibrahim kata tahun nabi muhammad saw laku hijrah makkah yastrib madinah jarak tempuh jauh kilometer kalau mau hijrah tuntut ilmu papa kan,2
ahh kakak suka xiao zhan iya oath love kapan tayangnyaa padahal lama banget ituu ooo chemistrynya kurang kak arti wah iya chemistry nya cepat banget,3
bei cecar bri usai kpk sita tabung rupiah triliun kait kasus korupsi edc,4
sepi bgtt semua yakk juga sih tadi bisa bangun tidur cek dulu,5
saya tidak enak badan pas weekend,5
chaeng kaget asa surga tidak sih disamperin bidadari,4
terimakasih nokaav bahagia selalu,2
orang kayak suka banget sama bruno mars,4
sabar cuma sedih,5
sedih bub,5
baca bitmoji stories suka tertawa sendiri karakter banget begitu tengil ngeselin,2
apa kabar,4
tau vibe pagi sedih pol,5
waa enak tuu moga libur bahagia yaa,2
sedih banget kalau support system adalah orang nicholas kalau sedih lagi sakit masa mau nang meraungraung manggil nichol kan mungkin mau jepang garagara ditenangin nichol,5
rasa sih orang dekat banget sama sekarang satu per satu jauh banget sama sekarang jadi rasa asing kadang diemdiem suka lari kalau ketemu orang apalagi kalau sengaja ketemu luar jadi canggung banget buat nyapa duluan,5
tagar viral pmii bukti generasi muda percaya perintah,5
iya tidak-apa-apa kok santai,4
kereen semangat,2
sekarang jam gin sepi dulu ramai,4
tagar ramai beneran kabur mending upgrade dulu barangbarang kamu biar hidup lebih enak laptop skincare koper outfit keren semua diskon lazada beli lewat taut komisi buat juga hehe,4
silah usah tanya saya suka baca tulis btari cantik banget,3
maksud sender alhamdulillah malu yorobun,4
aaaa semangat hari kak azutt,2
korupsi pasar jok boyo,4
keringat reaksi tubuh normal kita kontrol atur nyusahin banget utama buat orang gampang keringetan saya duduk diem suka keringetan makanya pas istirahat banyak lebih milih duduk diem biar tidak keringetan wkwk,4
kalau sabtu jalan sepi,4
sidang polri cukup sepi hari,4
bingungg yaa akhir akhir suka banget sama boker,3
baru kemarin ketemu spesies begini mana ngomong dibesarin suara kelas denger balas lah emosi kali wak,0
bisaa dong yah jangan bikin emosi dulu pagipagi,0
perlu kecewa kalah menang main biasa,4
pacar pernah antem pernah bosen sayang terus enak,3
sedih banget,5
taut nonton tsuma shogakusei narudrama jepang penuh tawa tangis,4
sedih bggt,5
malu apa,1
ott proyek jalan rupiah miliar kpk tetap sangka korupsi sumut lewat berita,4
mau bilang kalau buat manas manasin mantan mending sama bestie kakak biar makin asa nada canda dia malah marah sadar kalau saya sudah tempat nongki geng fitnah saya abis,0
aneh kok nder kamu dom mana kalau dekat ayo nonton bareng kutemenin nonton sendiri buruk bodoamat toh tidak kenal awala bingung normal banget kok,4
bagaimana saya rasa jauh beda dengan inti rasa sama samasama derita samasama bahagia semua sama,2
orang perlu ajarin attitude belanja deh nya emosi,0
maki bongkar dekat bobby nasution sangka korupsi topan ginting tim kampanye hingga jadi koboi,4
anak muda kudu semangat jangan letoy,2
alhamdulillah enggak jadi malu tuk sekian kali,2
sedikit informasi ini enfp terus punya love language woa sama kualitas waktu juga suka banget cerita semua juga dengerin cerita orangorang inti bawel saya mulai avail tanggal,4
jangan selalu kata ada waktu nanti laku segera guna waktu bijak,4
sayang istri lihat suka beli baju pesta shop langsung cushh beli baju dehh enak nya kalau hubung indihome mudah lancar kebtuhan online,3
sana boro boro korupsi mimpi korupsi sudah hukum mati bagaimana enak nok indonesia cuk,0
pantau balas dendam goro sumpek sejak dosen sing sak penake sendiri,0
semangat mass,2
kamu ngerti drun sedang jalan kerja anggota dewan dapat hak impunitas kadrun bodoh banget sih kalau edi mulyadi jelas hina luar biasa rendah nyebut kata binatang setan kamu kau dong tidak ngerti drun,0
kok buna kuat sih kok buna biasa percaya pernah tahap sedih kecewa luka saat jelas saya terima buat rasa sembuh sendiri damai ikhlas sekarang not only only jangan lupa vote streaming,5
enak tidak dengar nama korupsi begal rampok sejahtera kerja hidup nyaman,2
ayo emosi jangan sabar,0
sini taehyung salah sih aingmasalah marahwajar refleks ngelihat jisoo taehyung wajar kan lebih fokus hanna karena keluarga nya sana kurang fokus jisookrna kalau balik tahu dong taehyung usaha nanyakn,4
korupsi koruptor satu tidak pisah lama korupsi laku kecil apa jumlah koruptor selalu dan sangkal ini bukan masuk korupsi,4
kemaren nang kangen jimin sekarang kabar sembuh puji tuhan banget,2
satu lain rasa perlu bahas buah agenda politik hadir plot film begitu kentara lihat jelas awal hingga akhir film kami pribadi sih terlalu ambil pusing lebih pilih nikmat film,4
cuci numpuk gara hujan malam untung cuaca cerah hari,4
ngeri kali bah kpk geledah rumah nonaktif kad pupr sumut topan ginting temu rupiah miliar senjata api proses langsung lebih jam,1
padahal juga suka shipping aneh banget,3
kan sayang banget sama suami kalau suami sayang penjara bertahuntahun sangkut korupsi bts pasti sedih,5
buat lagi siap jlpt punya rekomendasi aplikasi keren bakal bantu ajar jadi lebih gampang efektif buat jepang cek aplikasi app store google play,4
makin benci sama jumat jam mual buah jalan darat tasik cirebon tasik sabtu kerja mantaaaap badan makin hancur ini tinggal tunggu mati lah,0
buat cewek nyaman tuh perhati erti egois ilangan over jaga cewek selalu kabar,4
ramai tagar istana kalau mau rantau punya skill,4
pagipagi sedih lihat beritaberita sedih jadi sedih kan,5
kak moga semua baikbaik yaa jangan lupa makan enak dengerin musik bikin tenang ada sedikit baik semangat,2
kaget loh kak msi pagi,1
coraline dulu pas kecil takut banget jir mana nyebutnya dulu kartun mata kancing,1
kabar baik sabtu pagi alhamdulillah,2
ide aksi daring cek sini temanteman,0
jangan pernah rendah diri sendiri kita luar biasaa,4
beomgyu sekali muncul suka bikin nang soal kangen soal sweet berat banget,3
mager membacamalu sendiri,5
soal korupsi impor gula tim lembong ungkap peran jokowi telepon hingga temu empat mata,4
ikut ikut sedih dengernya,5
two twts bikin emosi mmpir kuy,0
sidik kpk geledah rumah pribadi kepala dinas pupr sumut nonaktif topan ginting komplek royals sumatera medan sumatera utara,4
gilir segala bau islam dikebiridpojokkan alih omikron serius yang muslim marahimannya turun emnx pura muslim,0
semangat deh,2
kasihan nih orang istilah anak kolong tidak bisax main medsos malas baca bodoh beud,0
sedih banget denise leave,5
lucu banget jisuung twibinyaa happiest ulang tahun sayangkuu wishing kamu anything but only the best one your life jangan lupa mam enak hari,2
ulang kamu tryhard chamber nya santai tapi harus clear yang penting,4
kirain jumat loh vibesnya kaya hari jumat sepi,4
masih sedih difb base bisa kirim arghh beneran saya lebih pilih tidak-apa-apa keunfoll sendiri driada cari folls akun akun ram,5
bang johnny kalau lihat lebih dalem orang suka tempat diri belakang layar jadiin suka banget sama karena sama suka ngelakuin banyak tanpa lihat tonjol pribadi suka dapet perhati ken tani orang yang emang,3
mata nang kalau main makin stress panik buat paling asa pas siang hari asa timbul enak kalau ada dalam kamar kedap kalau luar ruang ada hawa angin ada justru oke banget jalan hari,4
memang sedang sepi selamat pagi,4
kucing hilang lps chi hilang cha xselera makan wife bgtw cha kurus mknn fav pun langsung makan rindu sangat chi ikut dulu selalu jilat chi ikut chi masalah cket xblh jalan normal masalah saraf kaki blka,4
thankyou gale kamu perhati banget sama suka sama,3
pagi buta sarap nasichiki boncabe hmm perut mulai tidak enak,5
njopp akan datang bawa cinta untuk sayank njopp sedih jangan lamalama semangat ayang love kamu banyakbanyak jadi proud kamu really cheer honey kamu deserve better kamu tersayangg lama,3
pagi tiba tiba baca banyak berita cebong ngamuk ngamuk cari banyak alas dewa nya harga luhut pidatocebong hibur diri pura pura bahagiacebong cebong bodoh idiot kalian permanentmentang mentang gratis kamu ambil semua bodoh nyaidiot,0
ihh mau marah,0
korupsi sakit suka rampok rusak dalam koruptor rampok seragam jabat kalau suatu negara mau maju korupsi jadi musuh sama koruptor hukum finansial sosial kompromi,0
jangan marah osah,1
duh tuh anak laku mirip banget deh biar dinasehatin terus tiap hari dulu suka nyindirin kedok self reminder mending langsung kasih copy pastenya tuhan haha,0
pagi dunia hari saya boleh sedih semangats,2
oke arti dia panik jadi jawab konsisten wkwkw,2
suka kagum banget sama cowok ambiss sama masa depan,3
malah enak,2
hari tidak berfikir jernih bawa sedih thankyou denise youre favorite maknae,5
baru minggu vegie kangen banget makan ayam goyeng akhir makan ayam kereta beli ayam mekdi spicy gambir maem bareng ayang nyuapin ayang padahal terlalu suka ayam karena mau mekdi doi mau tidak mau ikut makan sekarang senang tidak makan ayam,3
gapyear kalian bangun jam pagi terus ajar tidak ngantuk jam sekarang bagaimana tipsnya sender suka ngantuk sekarang meski tidur cepat banyak minum air putih banyak terima kasih,4
satu yang benci lambat sayang orang,5
pak lah ringan kan beban jadi orang tua takut anak nya vaksin anak tahun pak umur nya dada nya sering sakit pak vaksin satu terkadang mau nekad untuk bunuh diri terlalu tekan kena vaksin pak saya pak,1
siap suka banget,3
gila lockey kalian stay strong tidak bayang kalau member keluar kalau berita member keluar entah grup mana jadi ikut sedih moga trejo aman depan,5
bissmillahirohmanirrohim sih takut ina masuk grup neraka padahal ina sering buat grup jadi neraka,4
benci tahun,0
pagi menang menang metawin moga makin banyak solo projek solo endorsement series baru projekprojek yang bikin menang bahagia,2
dengar cakap orang commitment kamu orang settle kan tanya kalau puas hati manusia memang kamu ikut manusia sifat tidak pernah puas,2
pernah infinite kalau monsta pernah awal suka sungjong gara visual dan kiyowo banget kalau ngambek tuh kaya bocah terus pincut sama woohyun gara vocal nya sama sok ganteng akhir woohyun jadi bias pertama sungjong bias dua,3
saya jelasin hyung jangan jangan marah,4
mantan menteri dagang thomas trikasih lembong alias tom lembong jalan periksa dakwa kasus duga korupsi importasi gula adil tipikor jakarta pusat,4
suka gambar semua bagi satu sepatu malas banget apa yang tali iihh gaa mauuu,3
kita kabur beneran nih,1
bibi masak sayur bening katuk dong sama bakwan jagungpake sambel terasi sama ayam goreng enak nih mau menu iya tidak sayur katuk anterin yuk pasar sudah ayuk mbak banget lihat orang makan kemarin,4
kalau dengerin satu lagu sudah suka banget bakal ulang terus moal,3
lengkong bodoh,0
benar ragu baik ulur tangan malumalu sang kawan jangan bawa tempat anehaneh,4
sah bodoh,0
hmm imo seni untuk dinikmatin harus kuasa dasar sama kaya kamu harus paham hukum elektromagnetik buat main paham hukum aerodinamika buat ngayuh sepeda and lastly yang lakuin tidak rugi orang kok biarin bahagia,2
takut,1
bangsat banget,0
sebenernya waktu jadi seeun love first sight deh sama seeun nontonin stayc terus langsung suka banget sama seeun habis iseng jadi seeun malah nyaman,3
sabtu rasa emang kaya weekend tidak santai yaa ingat tagih nanti,4
ramai tagar istana kalau mau rantau punya skill,4
aksi pak jangan maaf mulu masih jadi suruh jokowi,0
kalau ceritain semua kamu takut kamu tinggalin saya suka sendiri,1
kei enak,2
biasa jiga kieu mah jadi jahat jaka sembung,4
kpk singgung kualitas jalan sumut buruk gegara kad pupr korupsi,4
sekarang masih suka banget sih sama air sudah ingin jadi mermaid sekarang mau jadi tyrannosaurus rex,3
alhamdulillah pagi dapet kabar baik,2
nugget sosis rebus enak ygy,2
ajar islam utuh jangan hukum islam biar jadi orang bijaksana adab,4
ika kamu benar kamu perlu marah kamu salah kamu wajib minta maaf,4
hai nottie semangat yaa hari jangan lupa sarap yaapy weekend paw,2
tolol tau crush nya ngerti bahasa inggris malah ngode pakai lagu western,0
jadi orang rumah dua rumah pertama gagal jadi tempat nyaman untuk pulang salah besar orang kau jadi rumah dua bisa pergi kapan tanpa kau tau,4
perintah prabowo terpa banyak masalah mulai pagar laut langka gas lpg demonstrasi indonesia gelap tagar kabur dulu sayang prabowo pernah muncul langsung jawab semua krisis sebut,5
sate anna kan suka banget makan sate,3
kamu saya kecewa sakit cemburu bikin sesak kangen galau kamu peka nang papa kok,5
simpang tengkawang antri kendara normal empat kaki simpang situasi arus lalulintas lancar,4
temu kentang goreng sangat enak akan memberitahu kalian tunggu tidak sekarang apa bisa jadi konten akan laku apa diri sendiri jadi makan waktu lama,2
taik benci twitter suka refresh sendiri bangsaat padahal tadi tweet lucu jadi baca,0
siapa jadi presiden akan sejahtera semua rakyat indonesia waktu singkat sebutin presiden dahulu yang bisa kalau,4
banyak idol habis kena word selesai loh tidak kabar sama sekali helloo,4
hitung rugi terima jaksa tinggi provinsi banten tim audit kantor akuntan publik korupsi pun turut rugi warga tangsel,5
lah tibe kena marah,0
masih megang buka preloved buku suka tanya detail kaya begini meski tidak jadi beli awalawal malas sih makin kesini sadar karena zaman sekarang banyak jual barang palsu harga normal jadi jual emang sabar,4
manusia kamu punya aspek cerdas sikap fisik biar tapi kan bodoh jelek sopan banget suka tolong atau anak galak tukang bohong jelek tapi pintar nilai bagus temenan sama minimal punya,4
pagipagi kabar senang bangett emang habis sediha selalu yang bikin bahagia,2
hubung keluarga mertua xde isu tegur semua ipar duai macam biasa buat baik semua orang kisah lah orang suka atau yang penting jangan sibuk pasal hidup orang jangan campur urus orang kalau yang adu pasal masalah rumahtangga layan,4
sedih kali wak,5
takut banget serius enih tempat curhat saya suka lupa mau curhat,1
nilai sindir video tiktok maia estianty panen kritik,4
menteri bumn erick thohir ajak warga manfaat lahan rumah jadi lokasi tani erick thohir mnggagas program energi tani energi tani brtujuan mmbumikn semangat tan shingga masyrkt mnghasilkn produk tani mandiri,4
lagi nyari jasa unsus unlock bisa yap unlock all case acc unlock umur acc unsus biasa acc payment laku akhir close uns permanen semi perm,4
kadang cewek suka pasang topeng sok tegar sok fine sok its gonna okay padahal hati bikin sesak banget,5
jarta sama ael pagi pagi bikin emosi anjing,0
potensi ancam amp implikasi serang israel iran tengah tahun lengkap gtgt key jumat budaya hari valentine cokelat chitato not your fault hyuna wiege,4
job sepi banget,5
yuk gasbayar utang puasa ramadhan tahun lalu sumber,4
rasa sedih hari nismlm tgk lgipgi takdehurmmapapon sangka baikk,5
semangat,2
ntah tolol beneran purapura tolol masih butuh informasi semua akun sosial saya buka umum,0
kasus korupsi chromebook jagung panggil wakil google jaksa agung jagung menjadwalk,4
artist the tahun jepang jeon wonwoo hun jungkookie green hari yixing telur hilang cokelat hidup jokowi are one chanyeol mark lee pak sby,4
semalem keburu tidur pagi nang banget kagett denise ngonfirm keluar apa sedih banget moga jalan pilih denise baik diaa dia bahagia sukses teruss denisee asli kenang ngestan jaman denise ingat terus jadi kangen,5
sangat relevan kondisi bangsa sangat puruk,5
jangan jebak tppo,1
nah baru imbang masa istri yang tuntut,4
jangan masuk psikologi kalau suka hitunghitungan suka usaha psikologi tidak harus pintar penting tekun konsisten banyak banget matkul sifat tugas jangka panjang butuh sabar konsistensi diri sendiri,4
masa pagi nang benci banget sma hati lemah,5
habis lihat cinta laura wawancara lama beliau ngomong nganggukngangguk soal rasa relate cuma motivasi yang kalah besar suka malas rasa bahagia datang bukan sendiri ketika saya bantu beri dampak,4
sayang wajamu genit mesraaku suka banget sayy,3
panik tetiba mata bengkak belah nyata alergi ibuprofen,1
macam sedih strees ikut xde duit tau tah,5
kalau kunjung suatu daerah seperti jamin sepi kerumun ada satu masyarakat keluar kunci jangan daerah biar saja daerah,4
rice cooker mini liter krem harga murah pesan shopee tokped,4
serius saya enggak terima brondong malu,4
summit konferensi kembang teliti buat bangun summit jadi sempat luar biasa ajar hubung para pimpin puncak space,4
have nice hari teh semangat banget nih lihat lihat,2
jadi orang sulit kontrol emosi akhir sekarang tetap sulit,4
arti marah,0
enak banget bangsat bisa nya bilang flop,0
warded muka sedih,5
hari selalu marah marah dia pens emyu,4
senang bangett pagi baru bangun dapat kabar baik jimin,2
viral tagar medsos reaksi kemlu,4
suka selalu arti cinta saja rasa kagum,4
enak enak kangen kerja masih suruh istirahat sama ayah,5
kaget banget pas nonton bagi tapi habis tertawa ekspresi gemes kamu,2
kakak jadi malu tau,1
sumpah nomor komen brcnd temen lumayan lama paling lama itungane mau tiga tahun apaso far jadi good galak banget sumpah keren banget anak kreatif suportip suka minum kopi hari habis liter habis bilang bisa tidur,2
tim bubur topping kacang kedele banyak kecewa dapat,5
betul phi tidak pernah merhatiin tanggal sudah ganti hari tuh sudah biasa tidak hari spesial,4
padahal akun sepi beda sama first acc saya lebih betah sini,4
capek nyari kerja nyari judul masalah rumah tambah diputusin pacar wkwk murung beberapa hari kostan ada bestie selalu bilang begini alhamdulillah sekarang dapet kerja bener bener ingin lupa sama sedih belum,2
kemarin coba tahan buat buka twitter sekali buka kabar kalau jimin sakit kaya langsung bikin sesak pas bilang kalau army usah khawatir bagaimana makin nang tapi saya syukur sekarang sudah sembuh sehat terus anak baik luv kamu,2
honestly not the cheerful type orang lebih suka diem kalau penting malas ngomong mau sok asik but tuntut peran jadi sok baik deh haha lucu banget maksain buat twofaced kesel benar,0
tipu lah kalau rindu guy suka buat lovebite dekat tits,3
harta kaya kad pupr sumut jadi sangka korupsi proyek jalan,4
jaga takut die terjun itu huhu,1
otak kaum kamu tolol pakai sumber nasional drun,0
sayang bakal satu batas suka batas teman dekat sudah lebih cukup insya allah,5
revisi proposal kira krevisi perintah nambahin jelas variabel hasil teliti tiap variabel hilang hari datang nuduh nipu padahal cust lain suka kasih bonus page kurang harga,5
keep streaming guys semangat,2
source,0
lah iya pernah agx tolol,0
hmm takut tetap usaha percaya diri lah pokok,1
banget kalau slr cuma balas ada marah ato bete wajar sih saya rasa salah,5
kemarin tapi dprd,4
korupsi desa cegah peran masyarakat sangat penting pasti dana desa guna benar yuk paham bagaimana cara baca lengkap,2
tibatiba ingat dulu pas ospek senior baik banget sama sampai ajak ngobrol pakai bahasa saya ngerti dong nyata pikir sekolah asal provinsi padahal beda haha tapiya tetap baik sih cuma agak malu tiap ketemu,2
semangat cantik,2
sekarang gilir kena kasus korupsi kali soal ada edc tahun nilai lihat siapa jabat internal jerat acung jempol buat,0
ular buaya tikus kalau panggang enak,4
lebih murah lebih enak daripada sri,2
sarap tenong enak,2
tidak sih main tim nasional putri,5
alhamdulillah jimin akhir negatif sayang senang banget dapet kabar baik pagi hari huhu sehatsehat,2
emang bisa kalau urus tuntut kerja profesional tuh libatin keluarga ngegampangin banget mau marah rasa enak kentel yang pengaruh hubung keluarga,0
terimakasih kakak bianca nama kakak cantik sama sih tidak suka suka banget kalau bagus terus genre horror sukaa kalau saya untuk genre lebih milih thriller,3
waktu indonesia pimpin truk dadi ratu surat takdir orang emban bantu batur pimpin suatu negeri besar alhasil rusak semua tatanan korupsi rajalela keluarga hidup mulya rakyat sengsara,0
avoskin miraculous refining peeling serum,4
senang ulang tahun mom sorry lupa pandai kata cuma mau bilang sehat sehat makas lahir saya keduania maaf selalu bikin marah terus kadang bisa ngertiin ada mama love kamu hahah dah telat hari,3
mandiri tanggung jawab rendah hati sabar takut tuhanitu sudah cukup harap,2
this economy rasa dunia ghibli,5
pagi nih cerah sini,2
becandabecandaan jadi sukasukaan jadi sayangsayangan sampai akhir saling takut hilang,3
perintah terus kuat tega hukum tangan kasus korupsi besar sita aset rupiah miliar bulan akhir tunjuk komitmen nyata berantas korupsi hingga akar,4
dua sih cuma paling bisa nahan nafsu buat marahmarah,4
orang kok suka banget cari salah aespa iri bilang sahabat damn kalau suka mending usah lihat,0
semua bayar balas dendam sasuke uchiha,0
thank kamu buat nya dom jogja moga taehyun member tubatu lain moa bahagia selaluhappy taehyun hari,2
tau kamu kan jadi malu wkwk,2
kalau main tiktok bikin kamu jadi orang tolol adab tau toleransi better kamu stop main tiktok karena konten jadi hilang attitude,0
tiap kali intuisi benar antara bikin lega ngeri sih,1
rcpc ada kabar datang lim waktu tolol,0
jangan sini malu,1
isu pasal didik paling tidak puas hati dulu sjk dapat fasiliti lengkap compare smkk,4
lho kaget baru sadar,1
puji tuhan senang banget pagipagi kabar kalau jimin bisa pulang rumah,2
gila malu banget lah,1
marah jual murah marah pada lalu tanya siapa sakit entah makhluk langka apa hasil sakit cinta,4
asli malu maluin orang indonesia tolol rep latah cilukba pakai huruf hijaiyah sama ngntd sama ganti huruf pakai salib tiktok filipin lewat fyp dan repnya ngtd semua dasar goblogg trend tiktok ter tolol,0
kalau makji aktif begini otomatis harap dapet saldo kaget padahal sering nyadar kalau akun lapak makji tuh gaib walaupun nimbrung ramai tiap hari,4
semangat kerja ayang,2
juga mau aware ttg isu sehat mental sini mau negasin karakter hana sebenernya bukan denialgengsi punya hati rata orang punya trauma seksual lebih sulit buat jatuh cinta nerima diri nya jatuh cinta terlalu takut,1
menkomdigi meutya nilai tren bentuk bebas ekspres,4
bagai mantan yeen lovers rasa malu moga cepat tobat bantink stir jadi yeen pobic gws buat temen kamu,4
yakan semangat hafal treasure nya,2
sedih banget onlen,5
saya lebih suka pakai aksen british walaupun paham banget dengernya enakeun,3
senang ulang tahun jiann adek gantengkuu gemes ucul kuat perkasa moga charamu kamu sukses terus bahagia selalu kasih banyak rejeki damai hidup banyak makin sayang sama kamu have wonderful hari,2
dulu medsos baca banyak komen pssi peleset panjang partai sampah indonesiadan sangat sedih mendengarnyatapi sekarang baru mulai percaya hal ituterlebih sekarang tahu kwalitas pimpin ini,5
sedih tuh lihat,5
kamu selalu beri argumen akan kamu sakit anjing kalau emang kamu suka sama fine tinggalin awal tidak perlu ngerespon lebih dari itu justru kamu ngerespon akan yang bakal jadi nyata banget,0
ibu biologi ayah tani untung nama anak normal normal,4
biasa nya kalian mgespace,4
terlalu cuek capek antem terus tiap keluh terlalu sibuk cuek malah dia yang marah like apa,0
orang cinta jangan benci mungkin tumbuh benih cinta,3
yang mata nya sembab begadang sembari nahan tangis,5
shipper belah kalau suka sama noren ush mampir tau benci sama noren malah baca nya kocak bngt kamu,0
dari semalem sedih banget sampai nang wong ada memb lockey semangat mesti bisa kok,5
menang kalau rambut turun cakepp banget paling suka,3
enak pasti,2
alhamdulillah luar biasa allahuakbar,2
mvs nonton sekian kali masih tetap mau nang recommended buat lagi mau nonton sedihsedih,5
iya iyaang mau reply biasa kong saya tag bapak adetakut nganu,1
tau berat banget depan jujur jalan buntu cuma mau ikut alur tapi percaya sedih kaya bahagia semua habis sedih nanti bahagia kok begitu balik semua sifat tidak apa kok kan hati luas samudra,4
memang jepang top saudara tua,3
takut sombong,1
