Tweet,label_encoded
yang salah formal informal sendiri alami kali musibah bantu malah jarah bhw sbgn diberikn biasa ini rampok vulgar pakai berfikir atas sedih orang,4
definisi sejak,4
emang hilang member sakit hati luar biasa,4
pagiii tom lembong klaim bijak impor gula untung semua pihak kini jadi dakwa korupsi duga rugi rupiah,5
the only thing like about this pro charge cepat less than minutes full kadang selalu overcharge tinggal waktu charge pastu terus lupa masa charge phone panas gila tau benda saya suka waktu normal use,4
menteri ketenagakerjaan menaker yassierli respons tagar viral media sosial tagar sebut upa aja ramairamai tinggal indonesia kerja luar negeri,4
jadi tuh rumah tempat tinggal sering banget amen kadang suka yang nawarin barang loh nah waktu rumah cuma bapak karena sama kakak kampus ibu warung sayur terus tukang ngamen betul bapak,4
paling suka kalau jaejoong nyanyi rock suara serak jadi keluar banget,3
habis vaksin dosis rasa badan suka gampang banget capek,5
terlalu sayang kamu terlalu bodoh paham semua main,5
kamu rasa sepi saat ada proses benah diri mengapa bukan jauh diri sedang filter siapa orangorang yang layak hidup sama,4
harta kaya kad pupr sumut jadi sangka korupsi proyek jalan,4
semangat,2
dosen sbm itb sebut cuat akibat butuh kaum muda penuh,4
heboh begini tanggap dosen itb,4
normal manaa investment verification,4
sharing ajar sama saja kamu nal rekan kamu berjejaring,4
berapa episode siapa takut jatuh cinta,4
elsheskin multi acids exfo peeling solution,4
suka banget sama per karakter grace seperti cantik smart banget terus nganut prinsip setia,3
orang suka kata jujur dapat tiga percaya cinta rasa hormat,4
trailer film kaget nikah eps keluar jangan lupa nikmat burgernya lahir jangan nonton dulu soal dewasa,4
alhamdulillah cepat banget sembuh take rest angel senang banget beb padahal lagi sedih edit nang,2
alhamdulillah baik banyak banget sih sejak mulai cut off orang orang sering bikin sedih,4
mental kamu tuh miskin banget anjingggg liter gilir kamu butuh baru koar koar benci banget saya kalau begini,0
bws ngert tweet ira benci tidak momen bawa tah benci trailer penuh sad momen,0
sini sepi banget,4
hai achanjkt kadang suka rindu kamu kangen typomukangen ingat sholatpokok nya semua deh salam kangen fantasticof,3
sok kaget dasar beban,0
jangan pikir gagal kemarin hari sudah sukses raih lama semangat sengat,4
nih tidak tau tuhan baik banget kasih calon ganteng baik ringan tangan suka bantu orang sayang baik banget syukur banget akuu tau,3
mau luk takut dosa luk mubadzir astaghfirullah bestie,1
pagi pagi lihat orang bikin pie lihat enak banget gataunya slime dayruined jengkel,0
nonton episod belum selesai,4
uish kena tarik bang sem teruk sem dapat selang satu sem kes pointer sem bawah sem dapat survive korek saving sendiri tahu ahli keluarga ikut takut kena marah haha,0
ngapain takut,4
kaya suka banget berfikir bagaimana kalau grup pakai coba grub kayak cocok deh pakai konsep kaya begini pulsa saya wujud,3
malu bngt jatuh parkir,1
luka banyak banget sini kalau tiba ingat suka nang asa sakit,5
empire corpses cerita ilmu usaha buat ngehidupin orang mati tentu orang dihidupkam tidak sempurna jadi melakulan jalan buat mecahin misteri akhir teliti,4
lanjut makan takut banget kalau lanjut makan takut pecah beling kecil masuk perut,1
lucu banget kue bentuk chikin hidup amen terimakasih banyak lis kamu sukses terus karirnya aduh kasih salonpas tau saya suka encok kalau dance huft terimakasih banyak lisa,3
enak atuh,2
kata bang koi yang suka komen kpop plostak plastik plostak plastik sudah kasih kerja berapa orang,4
benci rugi diri sendiri bagi besar orang kamu benci akan peduli benci,4
jangan kalau panik stres makin bawa badan percayain dokter sama suster penting kamu disiplin ngobat makan minum istirahat pukpuk stay strong brooo,2
telat sih ada line kamu paling memorable lupa structure kalimat spesifik bagaimana seinget bukan tegang karena sayang telat sama sekali tell anytime amd ill listen,4
mau tidur takut bablas,1
yuhuu semangat pagi yaww kak senang weekendd,2
kan jadi enak laku kita henti pura pura olah semua nya baik baik hati bukan baja,4
nah tunggu romo prabowo serius berantas korupsi batas omon omon,0
semenjak belanja online beliau suka beli barang sebenernya dibutuhin banget ujung ujung disimpe sembarang tempat terus ibu ngedumel jengkel,0
bahaya bagaimana bagaimana foto udara jangan nilai satu segi ini dapat yang bodoh,4
hahaha sama baca ulang volvoreta tau kakak tuh suka banget ulang baca volvoreta habis revisi haha ada part ekehm nya jadi amann,2
ikut vonis terima dakwa kasus koneksitas korupsi twp,4
bisa banget nyetel takut feel gonna cry,1
ahaha sedih banget tau gakk mau kapan begini terus,5
tengah ihsg anjlok luhut temu investor lokal pasar modal suhu politik tidak tentu investor asing pilih,5
enak enak kak,4
tikung tiga malam sebut nama waktu salat hajad chat bahas apa utama tugas pribadi suka terlalu clingy biasa ges kalau sudah mulai excited bahas nah situ kamu lebih,4
takut banget loch,1
lihat story mantan nikah begini nih rasa yaelah biasa sedih sedih tidak tau mantan lain mah,4
rodo ngeri sedep bismillah semangat garuda muda,1
pagipagi dikerjain orang haha kira bodoh saya ladenin lahh lihat manaa,0
memang momen nya jadi jadi tunggu sampai gelar formula benar gagal kpk punya alas kuat selidik kalau sekarang kpk masuk malah tuduh ikut gagal gelar kroni balaikota,4
adik ajak jogging pastu mimpi sudah jogging dia aci hahahahaha bodoh sekarang,5
kita bangun lebih kaya kalian khawatir indonesia dapat dana sangat besar timur tengah lain mengawatirkan bisa maju negara sulit bodoh,0
tiap sabtu kebangunin anjir grgr belakang rumah ibu ibu suka senam pakai speakernya tuh besar banget anjing suara kaya bener bener besar banget gila pernah tegur sebenernya ulang begitu kaya minggu depan besar suara bgst pen tdr,0
asli orang hampir mau mukul kaya berfikir berfikir itu anak orang takut jadi yang salah,4
publikasi tilik data judul potret kacamata ekonomi lengkap,4
lama ada kabar,4
frik ambis jelas malas rasa bodoh bisa nyimbangin asu kesan jelek mulu padahal rata rata oke,0
buntut duga pasien viral telantar nyata siloam bangka kena iur biaya tidak sah,0
suka banget flo yuk beli flo,3
open nih nomor biaya nomor target kalau mau,4
waktu kecil suka banget ngomongi masa depan teman teman besar malah suka ngomongin teman ngakaakk,2
sebab bagaimana solusi bisnis muda,4
baru sadar bentar ramadhan kalau grafik naik bukan biasa korban agenagen konspirasi global dunia kuwalik,4
apa fisik memang biasa mebuat tarik banyak kurang segala bidang tidak gagal cari materi tidak semua yang ingin wujud fokus cari banyak bukan dulu independen,4
hiyahiyahiya pesona pandang pertama tidak kuasa tahan emosi,0
duga soal tumben banget cube ngegas banget promosi lain jadi ingat coba helicopter kemarin cube kalau kamu ngapain anak saya awas saya marah beneran marah banget,0
drama abg tolol,0
naik angkot isi cowok semua anjirr malu banget,1
makin banyak paham kok saat heboh delta teman banyak rawat ortu rumah alhamdulillah sembuh biar bilang hoaks tetap suara bukti man teman sudah rasa kipi vaksin jadi ubah pikir kok kayak rasa dulu,4
puji tuhan bahagia banget rasa dapet kabar jimin sembuh,2
template travel itinerary simpel,4
prioritas utama sekarang kazuha sih mana tidak kabar,4
pandemi covid hambat investasi bangun infrastruktur daya tahan tinggia aspekaspek apa yang dorong wujud infrastruktur kualitas asiaa baca,4
alhamdulillah kabar baik,2
deh ngaku siapa mbeking nih bupati takut hisab panitia hari akhir tah,0
proyek jalan sumut ujung korupsi persen nilai proyek rupiah miliar,4
loh begini tiap baca cerita suka tertawa laku banget,2
tolol nama adek harus anak kecil adek yang posisi lahir kakak mau jecil besar ada urus dongo,0
milet biasa suara nya outstanding banget tambah alun piano nya hayato sumino,4
selamat ulangtahun moga sehat terus bahagia selalu yaa,2
musik sedih,5
bandung baca sekali sekarang bom berani reread sama suka banget kalau nya shita selalu jalan keluar senang ending walaupun proses nya rollercoaster banget kalau punya rai cuma baca chio ibel bom pernah baca,3
stuck nih tau kapan nih cerita takut bisa ngelanjutin pernah posisi tidak guys apa yang kalian lakuin biar survive,1
serpih apa anis untung waris hasil kerja jokowi ahok jarot tinggal cengar cengir gunting pita badut goblok mrt jadi busway pakai habis eropakampung pulo normal kalijodo rata coba sebut bangun anis guna,0
pernah suka pernah sayang tidak jadi,5
wedang jahe buat enak banget,2
takut siih,1
winner aamiin pede dulu biar lihat sedih pickaw sepi senyap minggu lalu,4
energi tani moga tani bumi semangat bertanierick thohir,4
milu cuma masalah selera ibarat senang pakai duduk yang lain senang jongkokyang keluar sama tai,4
tinggalin bbg komentar penyemangatpenenang buat member entah komenan fancam masing twt lain tidak bikin haters suka sama member naikin rasa sayang kita member lets busy loving each lain like this ivedive,3
kamu sih protes jadi kena marah kan,0
astra jadi pilih utama hampir seluruh produsen kendara motor indonesia oem kualitas jadi jangan ragu beli produk astra,2
jeje galak banget takut,1
harus cara nya biasa bener bener bikin speechless gilaa,4
korupsi koruptor dua sengsara bangsa seyogyanya wakil rakyat segera sah ampas aset koruptor andai korupsi negeri bisa cegah percaya negeri akan makmur,5
know that some ppl disappointed with his official appearance kalau sih enggak kecewa sama sekali because pretty ayato justice,4
ngeri banget,1
malas banget ngechat kalau cuma mau nirun huh sekolah lagak orang pintar suka nirun,0
sukses mion semangat,2
hormat angin semangat semua orang kita selesai waktu,2
pantesan gelar duga palsu minimal hasil nyuap sok keren guna istilah coattail coat tail buzzer profesor kualitas begini yang cuma ikut liqo minggu,4
orang cegah luar negeri kait sidi duga korupsi ada edc bri,4
denger lagu def sunset with kamu puter epicure semarang kaget bangga kwhskshssks ily bestie,3
jangan rasa puas tahu anda milik samudra ilmu bentang sangat luas dalam,4
yahh anjir itu yang suka banget lupa judul apa,4
nah kalau begini terus terang sama enak mas asal minta bonus besar,2
viral tren medsos kerja luar negeri banyak mati orang indonesia,4
baru sadar muka pas nikah ada beres paksa banget senyum photographernya bilang biasa penganten mah suka banget foto kalau mah susah banget foto,5
suka banyak orang suka temanteman oppa orang orang tapi masih tahu apa cinta,3
viral tren medsos kerja luar negeri banyak mati orang indonesia,4
nah kalau bukan pick girl lebih tolol banget anjing girl,0
gwinam kayak punya ingin hidup tinggi kan dendam sama chongsan,0
justru bikin biar ingat kalau sakit tuh enak kan musti jaga sehat jadi,4
soal kecil dicekokin kalau cakep yang kulit putih alias tolol,0
itu suka sama efek lembab serum soal kalau acne serum emang bikin kering yaa juga bukan melembabkan banget nah brightening serum rasa lebih beri efek lembab buat kulit,3
cuihh benci banget jual agama basi,0
korupsi tindak ilegal rugi negara masyarakat koruptor individu kelompok laku tindak korupsi dampak rugi negara masyarakat hambat bangun rusak percaya,4
maknae suka begini sih semua hyungnya sedih mau nang banyak maknae tetap padahal asil kan sedih kaya bisa nang depan kamera utama maknae big hit sih tubatu kalian sukses saya yakin,5
korupsi konoha luar biasa enak hukum ringan aph amp pimpin negara nya baik semua koruptor liga korupsi indonesia ribu triliun aman tenteram cek out suara rakyats video,0
denise sedih,5
apa inikok sepi banget,5
habibie persibday jepang doorprize cfd surabaya kaburajadulu hidup jokowi esemka,4
selamat sabtu jangan lupa jaga semangat,2
himalaya enak bgtt repurchase kali huhu,2
kamu tolol tytyd ngejawab rinci pakar apa begitu emang ngomong kalau ateis kan nebak skrip kamu kamu bakal kata bukan ateis gegar tidak follow akun ateis benar tebak,0
sama sama sayang suka manja pasang jadi pas banget buat kamu manjamanjaan suka sama anak manja lovely pokoknyaa,3
mau request langsung tulis kolom komentar,4
kamu punya uang punya backingan usah cari masalah sama orang rezim ted sioeng sampai gin orang biasa source,1
rangnick sangat kecewa menang mati tanding babak pertama sangat sayang peluang kena tiang gawang penalti gagal banyak peluang harus atau,4
alhamdulillah malu,2
orang jepang indonesia mah disanjungsanjung bro kerja indonesia jabat oke gaji besar beda sama lokal jadi mending,0
benar panik sih,1
minato jangan lihat sedih minato bahagia bahagia karena kau cinta,4
ada hantu rem psikopat ada sekitar bisa bunuh kapan saya baru eps lebih ngeri hantu vibesnya,1
waktu sma sering banget giniin yaudahlah makanya mana mana suka sendiri malah kena sindir untuk the point langsung bilang lah biasa gtkan pernah ngajak kalau sekarang tidak pada dewasa,3
kaget kok telat,1
tagar ramai media sosial ajak pergi luar negeri lalu bagaimana hukum pindah kewarganegaraan simak jelas,4
buat benci paling pak presiden jokowi cuma senyum tetap prasangka baik benci lintas rasa dendam sedikit ikhlas beliau super sabar ingat nabi muhammad saw benci yahudi hindun begitu islam rahmat lil alamin,4
sarap dulu bang biar bahagia jangan sedih,4
takut kok sama sky ancem gaji bunda potong bulan depan diem keki dengernya,0
benalu negeri bebas caci adil mati ujar benci caci lah alat kerja fitnah ulama provokasi kerja hari hari pecah belah anak negeri uang nafkah haram anak nya istri,4
maaf gais bodoh,5
raih sukses perlu motivasi kuat untuk bahagia bisa nikmat justru istirahat syukur anonim,4
senang ulang tahun jie moga sehat bahagia selalu pokok apa kamu moga kan moga capai terima kasih jie buat apa love youu jiee,3
kucing itu steril jadi cari kucing jalan biar sama dikawinin kucing jantan akhir kucing suka main teras tetangga dan kata suka berak sembarang sama berisik jadi tetangga ini marah banget,0
bobby nasution siap bantu kpk perlu kait duga korupsi proyek jalan sumut,4
jumlah takut banyak bener seperti tangan teror,1
alhamdulillah lintas lihat wajah beliau beri semangat inspirasi teguh juang sholu ala nabiy,2
semangat omapapun kerja penting halaljgn serah terus usaha kerja kerasinsya allah hasil,2
heran ego jadi manusia datang jalin pas sepi tinggal semua bosan mulai sehat jatuh asa terlalu baik hati,5
halo cantik betul sering curhatin soal per moveon kasih nasehat jujur tegas but gentle way sering juluk counselor sama tementemen jadi jangan ragu buat cerita sama saya,4
lebih enak sahabat dulu baru jadi terus nikah,4
rezeki banget alhamdulillah keluarga ada nuntut itu,3
renjana beuhh bagus banget sempet baca tamat wattpad naik cetak biasa nya begitu suka baca novel reinkarnasi soal bahasa biasa berat sini bahasa nya mudah erti,2
makanya kadang suka berfikir ini orang kok banget padahal skill nya tapi orang pintar and capable bidang justru rendah hati tidak sombong malah semangat ajar lebih tinggi orang biasa,3
enak banget buat yang suka klepon terus cinta mati sama eskrim,3
moga hasil negatif kak shasemangat,2
tadi beres tau kalau plastik digantungin kursi meja makan isi rambutan kecil tinggal sedikit kira kulit jadi buang maklum ada beres kalau tidak pas libur marah dong marah banget maap saya rabun,5
hashida wangi sayang normal,4
tuhan lucu bingoo thankyou selllll gemes banget kasih dino begini suka banget,3
takut bila start beli kang semua fav chara nak beli,1
fuck masa lalu gila pagi ungkit kupret anggap baik,0
cewek rasa bahagia pasang anggap ada anggap penting anggap cewek satusatunya,4
baru kirim foto,4
lihat yakin sakit suatu kau ingat entah orang bodoh hasil engkau tipu bagai orang baik kau sia,5
mandi sore soal mau les sedih malam minggu malah les,5
sapol tapi takut tiba yong drop,1
enak yak,4
makin didengerin suara makin enakgitu kok duet sama jungkook ada dia sawan,2
malu japp sshh berapa haribulan ngomong ngomong,1
yah sedih,5
mau marah skg malas,0
nyerah joki kali tugas poem allah saya bodoh ing,0
korupsi adl khianat percaya rakyat amp koruptor adl musuh bangun maju adil,0
hai widyaa jangan lupa sarap bahagia hari have good weekend,2
txt members sepi sepi kayak lagi ada schedule kemaren,4
beasiswa luar negeri bulan maret punya citacita buat coba apply beasiswa luar negeri bestie share beasiswa hunters lain yukk,2
kalau santai,4
rem ttg sikopet nder nonton lebih eneg sama takut gegara main bunuh ttp nonton habis penasaran,1
makin jelek nama indonesia negeri orang biar jangan,5
hanya manusia biasa tidak sempurna adn kadang salah,4
love youuu kaputt sehat bahagia selalu yaa,3
ada fase nang tau bawaanya sedih padahal tidak ada sedih,5
sebenernya malas bbgt tuh kalau bikin persona saya biasa sama newwie padahal nya mah gila bangt akwkwawkkawkaw,2
mode biasa mode intai,4
grandpa vibe banget dulu kakek banyak suka kakek jatuh hati sama nenek kamu,3
bahkan saat parah krisis ekonomi ada gegap gempita apa beda status kelas tengah ajar sedang merosot dekat status tkitkw hanya gairah baru lanjut migrasi lama kaum tenaga kerja idonesia,4
takut kecewa sama ekspektasi,1
suka banget tempat dingin kaan keren sangat lohh tempat ehh exnow best teman salah satu suhu coal lain uhukk pampang nyata nama sih sombong hahaha malesin,3
kalau bisa sampai jumpa hari kamis,0
beri kuat yang lemah tambah semangat yang tiada daya,4
semangat mbak,2
presiden sendiri bilang demo susup asing bilang demo ndasmu sejati anti demo takut yordania,0
nasi cikur teh nasi goreng pakai cikur kitu teh enak pakenanyaa,4
ayah kata lelaki tidak paksa hal apa makan dan sabar jodoh akan dan jemput kamu minta,4
islamofobisbuzzerp njing pil komunis laku maksiat ingin cari benar atas laku para bbi kafir cundang debat teologis akademis ingin lampias dendam kalah,0
lah ahah kira orang biasa pas lewat gasadar makas judith uwu,2
enak cantik,4
tetap viralkan emang perintah yang ngegas rakyat,0
akan sempat dua tahun kalian bodoh semua data hasil kaya sia sia buat cerdas kalian,0
senang ulang tahun lovely eonni suka banget sama young dulu segi acting visual tubuh mungil perfect banget dia selalu nantiin projek drama nya awet muda banget doa baik buat ayang moga karirnya makin sukses iya love kamu,3
google akhir periksa soal duga korupsi chromebook yang dalam jagung,4
eddy misero secretarygeneral akumindo believes indonesia offers significant potential business development despite the growing trend just run away first among youth seeking opportunities abroad read more,4
benci kau,0
ramal zodiak sabtu februari emosi positif laman riau,4
menaker respons tantang buat cipta better job,4
paling malas banget dapet message suka tarik iss masalah hidup kamu apa sii,0
sedih banget jadi wanita,5
negara taiwan kamu joss kedelai jadi minyak goreng biji matahari jadi minyak goreng bunga warna kuning emas jadi minyak goreng luar biasa indonesia kamu kaya raya bahan baku kok langka minyak goreng stop goreng goreng dehh rebus masak,4
hotel ring malioboro teriak saya jadi tonton,4
kpk periksa saksi swasta kait kasus korupsi asdp nila rupiah miliar via,4
biasa pink sekarang ungu nyata suka wangi mohon kaya bau orang saya suka banget sial nyata pakai,0
bengong bodoh,4
jangan korupsi tau nontondenger berita media asing sudah tinggal kenang,5
sedih,5
semangat ngantornyaa,2
baca oleh ariel heryanto judul tulis banyak tafsir tagar bagai ungkap putus asa warga kondisi ekonomi hukum sosial tanah air,4
sial iyalagi kalau dira tidak sayang saat thailand,5
rada ngeri yaa stranger,1
perintah buzzerrp banyak makan duit haram jadi otak fungsi,0
takut bisa makan,1
habis sakit hati tolol banget emang,0
jalan lurus pergi bogor semangat terus jangan kendorgood luck yaa kak,2
yang kelimaa anjing sial mulu minggu bangsat besok apa nih taiik,0
enak body,5
enak seh gawe tandang gawe buru,2
enak mana,4
pepatah lama bilang ada suatu pertemananpersahabatan laki perempuan salah satu sukajatuh cinta sama temansahabatnya even its platonic love its shape love lagi kamu dulu belum pacar kan temen biasa soyeah,3
emosi tgk banyak post owner mati kucing akibat virus parvo bukan emosi sebak emosi nak marah tolong vaksin kucing dulu taktahu pntgnya vaksin kucing,0
semangat mbull,2
bila ada kerja sangat saya takut takut tktau nak update apa dsu esok,1
daerah beling ada yaa nama palingmengabdi siap daerah mana mukasongong,4
kalau sedih,4
suka banget sama fubuki nyanyi,3
subsidi murah kak tempat biasa steril,4
pagi pagi bikin emosi yaa,0
hdeuu marah yhh tempe digituin padahal tempe makan enak muka bumi inie,0
duga loni takdok ore kijo kijo sari pastu tkse banyak doh ore kijo tetapi lekat allahu sedih nya gano tinggal sama nati sebab siapa loni kijo mana mana sobs,5
biasa roti apa yang ringan,4
sebentar mereka kaget ada rencana ada ibukota halu,4
ngeri banget seperti drama thriller psikopat,1
sedih banget tiapnliat kucing kasih makan suka antem rebut padahal semua kerja sama guling saya bagai manusia kapitalis pegang kuasa sumber makan mereka,3
butuh situasi yang makin kusut akhirakhir,5
saya suka banget banget sama cilor,3
perlu sempurna bisa bahagia sederhana mampu buat jadi bahagia,4
jarak damar hampir ada saya toleh cium bibir tibatiba saya suka sentuh tangan lembut sirat sayang sana,3
alhamdulillah jimin sembuh sudah pulih kabar indah,4
sedih emang kalau tinggal temen ngebucin sedih ada waktu main sama temen sedih ingin ngebucin,5
tren kalang anak muda indonesia jadi sorot media asing,4
jadi kalau banjir macet polusi jangan nyalahin gubernur kak mau kim jong jadi gubernur tetap jadi salah diri sendiri masih mau tinggal jakarta salah tuhan cipta,4
sedih sudah,5
itu meski banyak aktifitas beneran santai sama sekali tekan skip aktivitas kalau sibuk cek nih kalender februari bagaimana seru tarik kan tunggu rumah natcy,4
ohh jelas banget donk suka banget situ kakka jay sama kak heeseung keren suara wah ide upcharku spontan sih bagaimana dong,3
takut banget lohh cacing panas ahah,1
halo aduh interested banget potray the betul side all member svt kena kalau ketemu saya love language woa physical touch lepas supportive sweet kata buat pacar suka hugs kisess,3
analisis amat ungkap makna balik indonesia gelap,4
kecewa sama diri sendiri,5
malu benar benar malu,1
emosi banget miu tahan supaya gebuk ele,0
sepi euy,4
bos mau tani pagi enak yuk sini like itsyourfriend,4
temtu akan hadir,4
edisi spesial valentine samsung galaxy,4
suka panggil sayang ayang kalau kamu manggil kok diam,4
wkwkwk biasa awal cobacoba kepo lanjut tagih kalau suka sih bakal lanjut dulu kepo bau tembakau tuh bagaimana tidak enak pas lab waktu ada bawa tembakau bused bau obat rumah sakit enek banget,3
kalau nak sniff sekarang kene hati hati takut kepam,1
suka begadang suka kopi suka malam suka besar kamu,3
gatauu sedih kalau lihat foto cogan,5
jurnalpatrolinews jakarta mahkamah agung sama kabul mohon tinjau pakai aju mantan ketua dpr setya novanto kasus korupsi proyek ktp elektronik vonis hukum setnov kini rang tahun jadi,5
ajar anak lelaki tunduk pandang lawan jenis lebih saat milik istri cukup lah istri karena poligami bukan yang mudah boleh kdrt baik fisikverbal jangan milik pola pikir orang atas,4
sedih banget kaya huhuu kisah mulus sekali mana relate banget sama lirik samping,5
tadi waktu mau berangkat sekolah kan salim dulu kan sama ortu terus tadi mau salim ayah kata sana berangkat jadi cuma salim mama sumpah kenapa susah banget tinggal julurin tangan doangtadi jalan berfikir keras nahan tangis,5
nah cwe bodoh lah contoh guna tiktok bodoh nya sampai dna,0
uwah semangat besok lusa,2
lain pamer capai pinggir panggung pamer primitif nya tidak sekali,0
nonton drama sama mama terus kiss scene panik,1
andin bawa kesinihazel bayi takut flu,1
haloo nadhie huhu suka banget tulis kamu buat lee chan huhu diksi kamu cantik banget tulis kamu selalu megah huhu tidak temenan sama kamuu,3
ngaco kalau mau bantu jangan susah sama rakyat kok,0
pagi buat emosi,0
kaget heran ngomong,4
jangan lihat sedih minato bahagia bahagia karena kau cinta kushina,2
kemaren demam tenggorok nya sakit allah takut,1
seperti bukan cuma nica yang suka bonceng juga laku perdaganganpenyelundupan manusia cek ombak bonceng tagar hati gengs,1
syiah mesra sama pekaimk nya mereka benci sama islam ulama,4
aahh iyaa bgtt hazaa tbtb bawa mellow bgtt yaa semangaatt hazaa moga mellow kzl sedih gajelasnya cepat hilang,2
semangat hatihati jalan mei,2
sarap sih lagi hujan indomie soto plus telur enak kali,4
presiden prabowo rapor hijau berantas korupsi,4
paling suka sih sama line guardiannya akhir kali seinget yang versi thai guardiannya bilang telah all life merely longterm homestay bener bener astaga mixed feelings banget pas denger,2
say bagaimana cara mainin asa cowok nanti cowok sesal ninggalin cewenya kata temenku biar pikir cowonya ninggalin pilih bodoh,0
alamak ngeri kali,1
heran coba bisa cma saja,4
jarina hasebe hobi omel marah marah,0
siapa tau lewat twitter anak biar malu orang makhlk tau diri,0
semangat retwit,4
komisi berantas korupsi kpk ungkap praktik korupsi proyek bangun jalan satu kerja bangun jalan nasional satker pjn wilayah sumatera utara sumut,4
pagi minta kenal yuk kamu kalau deketin yang marah,3
tuduh pki marah kamu drun,0
semangat senpaii,2
semangat kata,2
ajar atur sinus cosinus segitiga apa reflek jawab segitiga sembarang segitiga abc pulsa malu banget tidak salah kan shshsksjsjjh malu mana jawab cepat bgtt,1
menteri ketenagakerjaan menaker yassierli respons tagar viral media sosial tagar sebut upa aja ramairamai tinggal indonesia kerja luar negeri,4
halo bpkibu mohon maaf atas ketidaknyaman alami perihal sebut laku pasa menu pesan bpkibu juga laku tracking lalu taut kirim nomor ponsel lalu whatsapp smsnya,4
suka banget sama dua,3
banyak kok film barat romance saya suka banget sama film pride prejudice,3
malu banget idm masuk cowok,1
aneh orang mah suka cerita mimpi mimpi malah jarang banget mimpi ada bagi malam mimpi mimpi suka jelas jadi pas bangun saya lupa agak kejut,4
kaka ica apa kabar,4
sumpah takut bangett rem bangett orang,1
sedih saya lega bye,5
normal saya kena reject,4
takut jual,1
kok rasa fase maj apa malu sekarang,5
omong sesuai nyata jabat tolol pelihara negara,0
