Tweet,label_encoded
hyundai venue resmi luncur iims banderol rupiah juta agam fitur tarik lengkap gtgt key jumat budaya hari valentine cokelat chitato welcome indonesia ilichil ungu hyuna jaehyun wiege,4
update sidang lanjut tom lembong kasus korupsi impor gula,4
terus ngapain dipacarin kalau bisa kasih pasti kalau tinggal nikah sedih sesal,5
sedih campur senang akhirnyaa jim sembuh huhu kuat banget jim,2
mungkin rasa enak pak gopal tinggi jabat aafikabbogor mungkin kira cuma canda mau negur berani mau marah tidak berani mungkin yaa,0
bener wkwk jual beli suka suka whales kira whales satu ada banyak grup pisah pisah mau jual beli suka suka malah kalau jual bilang tiba sorr bilang cuma pas serok patok paling enak tradfi sama makro ekonomi,4
rasa lada nya strong banget lebih suka sedikit lada,4
juga tau sih yaa tiba begitu pincut buat jadi jennie suka senyum lucu banget,3
enak banget pak,2
pagi bang sarap bubur ayam enak nih bang,2
geleng heran dengar canda gori masih tetap tanggap santai yakin lah yakin kalau puas saya jajanin krim hari satu lama hari joshua bersih dada gori teliti,4
kita keliling chat saya emang anak suka banget ajak putar putar dadak sama orang sayang simpel sebenernya bahagia,3
sejak hari tidak satu orang percaya teman sahabat saudara orang tua bukan orang yang tepat buat cerita segala senang sedih bahagia maupun susah bahkan tuhan seperti enggan jadiin tempat adu,5
pakai buat daily cocok asal pakai buat hehe,2
assiikk hari sabtu nih masuk kerja tetap semangat yaa indihome selalu dukung aktivitas onlinemu,2
menteri bumn ajak warga manfaat lahan rumah jadi lokasi tani erick thohir gagas program nama energi tani jelas gera energi tani tuju bumi semangat tan,4
astaghfirullah marah marah,0
tetangga muslim tinggal meski laku sering jadi omong tabur doa wagtp tetangga non muslim jarang berkonflikhanya ucap turut duka terucapapakah takut tidak mau mendoakanpadahal allah baik baik kam dosa astaghfirullah,5
ronaldo usah sedih saya loh main bagus jelek gaji tetap langit elanga nggeh bar langsung pesta saya,4
dari kota belah kena penjara bulan denda nya gegara kerumun lah inikok maaf orang biasa bodoh ngertiatau jangan ini dibodohin sama begini,0
brrti nya sepi wkwkwkwkwkwkwkwkwkwk ngkak,2
alhamdulillah jatuh jatuh tempo bulan sudah bayar tinggal recehreceh nya semangat pagi,2
buku sih kalau ada mau beli huhu soal gemes banget suka model ada ilustrasi begini,3
kpk cekal mantan wadirut bri dirut allo bank kait kasus korupsi mesin edc,4
orang bodoh mati cinta akan tahan hidup cinta ryo saeba,4
selalu guru ingat kelas beda vibesnya serap energi guru guru seperti guru masuk kelas mipa awal santai santai ada semangat pas keluar kelas serasa logging out serap energi sama kelas,4
open guyss biasa yah kalau mau instan malam bisa wkwk,4
hahaahasedih sangat fren kongsi sama boboy,5
buat hari kamu deserve senang anw jangan lupa sarap cantik,2
lagu sakusa habis diputusin atsumu habis misuhin lagu yakali ajg bisa benci kamu yakali ajg cari baru mau kamu yang baru dengan benci kamu,0
korupsi sperti crita fiksi indonesia tetapi ada selamat hari kamis kang maman,5
jake bias wrecker bangetsuka bikin oleng,3
sumpah jadi enak banget tampilanya bersih banget smooth scroll jadi nyaman banget coy,2
suka banget sama toko hijau beli barang harga ratus juta ongkirnya ttp,3
iyaa juga jadi takut,1
cari harap tengah puruk,5
sedih,5
pagipagi kabar baik kalau jimin sembuh tinggal jalan masa pulih alhamdulillah sehatsehat terus jimin,2
cek pers biramas situs,4
cukup unsur moga rakyat ambil ajar depan lebih cerdas pilih wakilanya junjung tinggi etika moral aamiin,4
baim wong kaget temu banyak ular rumah,1
komisi berantas korupsi buka peluang panggil gubernur sumut bobby nasution temu alir uang kait duga korupsi proyek infrastruktur,4
denise moga kamu bahagia,2
pagipagi bangsat,0
senang banget lihat pacar salting wkwkw kanu bebas manjamanja farrel farrel suka farrel bakal beri kamu banyak afeksi banyak peluk banyak cium wkwkw farrel masuk tipe fast respon,3
ajar jlpt jadi makin seru bareng jlpt dokkai point amp practice latih soal ala uji asli stepbystep baca pendek plus jelas visualfriendly cocok buat mula amp juang jlpt bonus mock test,4
allah farr turut duka hhuhupdhl tiap kamu ngepost selalu mbatin kcg fara lucuk bgtknp sekarang pergigapapaa faar meng nya tenang disanaa jangan sedih yaa meng nya ikut sedih,5
wkwkwk takut banget gigit,1
source,0
semangat fiony sehat selaluuwe selalu love kamu,2
bukankah kamu lelahatau sesuatu pikir jangan paksa diri terlalu keras semua baikbaik,4
mbl mbl murah banget loochh ayo guys join miracle suka drp jajan murce sering open shring merch dan sekarang open tabung buat coba bangtan tabung mulai guys yuk gass join taut rep yaa,4
kurang tolol coba agama tuhan beri hukum cerai malah nikah anggap zinah goblok ada yang mau jadi kristen emang sih setololtololnya monyet tidak nyembah sama monyet lah manusia kasih akal kok nyembah sama manusia,0
bodoh emang bisa apa apa kamu zar cuma beban,0
jagung periksa marketing google kait korupsi ada laptop chromebook kemendikbudristek baca sini,4
puas banget mam seblak,2
kalau bubur kaya begini aduk enak banget mohon,2
bahas cuma masalah ekuivokasi bib ceramah orang paham positif lah kalau masalah frasa pukul makna variasi konteks fikih pukul boleh yang didik bukan cedera koreksi bib,4
bekas sekretaris sama nurhadi baru kejap hirup udara bebas langsung tangkap oleh komisi berantas korupsi hal jadi,4
aktivasi takut valid,1
semangat kak setia tunggu,2
benda paling sakti ini bukan nuklir doitia itdo apa sajahampir semua beli,4
genius kang taehyun senang ulang tahun anak lanang sehat terus jan sakit kalau sakit marah kangen tyunn sulap pengin tyunn konten masak terus upload,0
suka banget,3
ayoo kyy semangat bareeng ramein opmemnya wixst yaa,2
bodoh banggang sedaq diri sendiri orang kata jenis ret syukur banyak mana ttp akan cukup hati pulak cantas bukan main bodoh banggang habaq kata lani tukaq senang orang tua takdak nanti semua potong nama,0
kalau blaja keje jauh gaul rasa pun benci ngan perangai terimakasih everyone sebb jadi contoh baik,0
semangat kasih minum nih,2
tau rasa senang juga sedih,4
sedih jadi hibur,2
iya kaan lain suka coba tidak-apa-apa tetap takut wkwk,1
sebenernya suka banget sama suka backgroundnya warna pose kenapa senyum kecewa,3
kok kamu bodoh,4
semir kondisi ekonomi negara memang tuju perintah miskin rakyat jadi perang horizontal mereka bayar,5
morningg irish semangat hari,2
jangan takut jarak jarak telah temu,4
buset sedih wkwk,5
obat stroke paling ampuh bio nerve pesan,4
taurus kamu tuh kadang egois banget keras kepala suka pendam kalau rasa nyaman susah lepas tukang julid terus kamu kalau loyal coba beri batas dong,3
tahajud dhuha tiap hari powernya saya luar biasa nder,4
kalau lihat musuh pasang title takut malah,1
alas picu brain drain,4
cerah,4
ngaku lah bodoh ngajak nder nganggep adek cuma anak kecil kamu,0
hai jinni cantik banget profilenya lagi suka lagulagunya cigarettes sex sih yang kalau kamu akhirakhir lagi suka dengerin apa ngomong ngomong selamat untuk debut,3
hawo mowning dynda kabar baik kamu bagaimana,4
semangat pagi,2
kaget takut kemarin minta kurang banyak,4
semangat november,2
jepang buka suara soal tren viral media sosial indonesia duta besar jepang masak yasushi kata perintah negeri sakura sambut kerja asing terampil bagaimana kalian,2
biasa pagi mules,4
laku buat jual sih kalau ada take least abar calon buyernya biar samasama enak kalau samasama ghosting bagaimana wkwk ngeri,1
tolol banget nilo jilat tai sebdiri guwvtakut siiii bayangin omar marahh eumm,0
khawatir,1
ngeri banget emak omel omel mahmud buat edukasi cara ngedidik anak haha,1
baru bangun terus buka dapat kabar begini senang banget ampun,2
anjrit kaget renjun,1
join makan mewah cheapskate baru semangat buat kerja tengok semua muka senyum muda cheapskate sangat muka memaseng tegang tengok memaseng pay attention bila yang lawak kalau tgk meja muda memaseng tunduk pandang lauk sendiri,4
anjir sedih deh mah asa lengkap,5
aint lockey but feel bad that buat lockey jangan sedih terus yaa wish all the best denise rahasia nomor and lockey semangat terus lockey buat dukung denise,5
tetap jaga komunikasi sama temen sudah nikah pas sekali ngechat aku tanya kabar malah tanya kapan nikah tanya cuma jawab senyum ujung tidak balas,4
semangat,2
seru nyata nontonin orang bodoh,2
kadang diri suka paham sama asa diri sendiri tau mana beneran sayang mana cuma dar pura semua orang anggap sama beneran tulus buat temenan sama semua orang pilih allah tidak pilih masa diri manusia biasa pilih sering kecewa,5
jangan lupa sarapann semangat buat hari ini ayang moga hari senang,2
padahal suka marah marah kamu,0
makasiih iya ampun kaget bangett,2
rekor perintah jokowi menteri paling banyak jadi sangka kasus korupsi belakang aparat,5
asli pikir temen sedih bisa jadi kutu beras aneh saya makin ngeri sudah,1
pkb bentuk rasa cinta indonesia,4
kenal anak mipa tidak dengar kabar nya,4
lagi case sepupu jauh jawa kerja malaysia arab saudi tetangga kerja vietnam bekas rekan kerja sekarang jadi awat arab saudi jauh hashtagh,4
bukan lockey ikut sedih lihat denise keluar tidak panjang kontrak sama agens terus beri buat fansnya,5
full cream cashew enak banget marie oke lah nyoba matcha,2
jurnalpatrolinews jakarta sekretaris jenderal pdi juang hasto kristiyanto sebut tim jaksa tuntut umum komisi berantas korupsi kpk sengaja pakai,4
singlekarena ada sukalagian nyaman cinta jauh sana,4
suka banget kalau dominasi sudah jangan kalau saya tara,3
tuju,0
part kala tantrum emang asa banget emosi nya situ sudh mulai mau nang,5
apa kabar gaaiss mam pagi,4
bola voli indonesia beramairamai karier korea selatan bukan tagar kabur dulu coba ikut jejak megawati hangestri,4
akhir malu,2
jawa timur,0
masuk perencanan tinggal nunggu,4
terkadang situ rasa sedih,5
enak tambah tingkat kemageran,4
suka banget cantik tas,3
banyak orang bahagia hari sakit sembuh sehat jaga sehat yang sedih moga cepat bahagia,4
bangsat kamu member malik anjim,0
mau dong mutualan akun baru netes sepi banget,5
sayang ibu kos jadi satu rumah sama kos luar kota malah jadi ibuk kos bisa lihat langsung laku jadi tunggu blio datang buat jenguk kos soal blio suka datang dada wkwk,3
enak nih pagi,2
sama biasa jalan paling pinggir bilang sorry,4
smt program indonesia hadir sempat emas buat kamu mahasiswa indonesia ingin ajar langsung pakar korea punya impi korea gratis biaya,2
kompor induksi cocok masakan asia utama masakan indonesia contoh mau bikin nasi goreng bakal enak pakai kompor induksi nasi goreng butuh panas bara kompor induksi sebar panas nya lama banget,4
aaaaa sedih banget,5
main pakai first pon kalah dengan kelab bodoh apa bala,0
majikan lewat minit takut dengan allah kita langsung takut kadangkadang salat dekat nak habis waktu uai,4
bohong biasa marah marah tuh lihat,0
wah sekolah semangat yaa,2
puluh ribu warga protes atas tangkap aktivis juga tuntut milu cepat berantas korupsi serbia,0
saya pengaruh pakai pas malam mau tidur besok normal mending,4
semangat,4
kadangkala diri henti beri buah perhati orang untuk sadar ketidakhadiranmu buat sepi,5
kali otak tuh biarin stay kepala jangan pindah pindah kontol juancok tolol kan jadi gih musnah ngehabisin oksigen kalau hidup,0
semangat abang,2
asa punya ibu dua nyokapnya tementemen checking kabar masingmasing semogaa ada suram begini cepat lalu,4
jangan lupa minum habis makan takut keselek,1
emang dasar nya tolol semua komen,0
jadi soft malah emosi,0
wkwkwk mana uah mau end kan emang adnan suka banget bikin pikir wkwkkw,2
mana hati senang,2
samasama sayangkuu gemes banget snacknya huhu suka banget maaci cayang mwaah,3
makin kesini snowdrop stan makin lucu tidak sedih sedih,2
langsung tahun korupsi ada mesin edc bri capai rupiah triliun,4
sedih orang suka hakhak,5
awal malumalu lamalama mau vote the,2
jadi malu,1
lebih takut arab puncak,1
akhir bangun siang bodoh tidak salat subuh,0
serius tubatu tuh juara banget title track nya debut smp sekarang ada tidak suka huhu,3
betuul suka ingin cuma monoton banget kalau makanya suka ghosting,4
tidak paham kondisi waktu kamu nyari buat bincangngobrol kaya biasa kaya apa bodoh nya malah ceng gabutkasian maaf banget tidak tau kamu bakal marah maaf banget beneran tidak maksud buat saya cuma becanda biasa,5
sir baik kena balik panggung mimpi ngerikuang kuang kuang,1
kamu mau santai masih banyak tugas numpuk solusi sini yuk segala macam bentuk soal apa yuk langsung joki tugas dmwa taut bio testi cek thread soshumpendidikan,4
woww niaga angin tuhan free pon kaya raya kera bodoh tipu manusia bijak pandai jaya plak,4
lucu sedih rem kok sii,4
banyak fans sakit entah bws shipper main pasang series posisi menang sama female lead series baru jadi serba salah mau dekat bright hujat dekat bilang ada momen itu ngebuat fans kecewa,5
nasib bobby nasution kasus korupsi proyek jalan bakal periksa kpk,4
ramai pap foto ayang wkwkw terus jadi tau deh bias temenku siapa soal ngepost foto oppa kan pantau ada bias winner nih bagaimana kecewa,5
biasa kalau titip kenapa ibu tau ibu suka lupa nitip ibu biasa nitip saya terus balas apa nitip apa nyenyenye malah ngegas saya kasih tau biar kalau nitip saya saja biasa kaya ajg,0
ayok segera bersih manajemen bank nya nih penuh kotor tirun turun saling tutup,0
meski tiada jasa glenn fredly industri musik tanah air sangat luar biasa karyakarya glenn fredly cipta glenn fredly saat terus dapat hati masyarakat indonesia,4
punya kucing putih paw pink impi rumah tapi papa lama bahagia milky naik kasur injak sajadah,2
waktu salah satu cara baik bisa laku weekend ala kalau suka banget weekend nonton seri televisi puas pakai indihome kalau weekend versi kamu apa nih bestie,3
enak dong,2
ramai begini respons istana,4
heizou padahal bgarep bangey sedih bnaegt,5
biasa orang fomo mobil baru tiba rejeki limpah jadi mau upgrade tiba butuh uang paksa jual aset ubah situasi misal tiba hamil butuh mpv sempat jadi mobil indonesia pakai dar sesal cocok,4
tidak sok pintar sih mungkin kamu yang terlalu bodoh lihat kaya,4
apa weekend mah kaya hari biasa banyak tugas,4
barusan lihat trend denise kata keluar ampun sedih banget baru bangun baca ginian,5
dari luar biasa nafey,2
nah iya enak gara gara taeung jadi ngerti mana prioritas sifat enak sudah temennya suka drama nang beneran dedikasi banget taeung kan bingung jadi yaudalah bye,3
jaksa tetap yrs mantri bri cabang klaten sangka korupsi dana kur nila rupiah miliar,4
sabar yah orang kecil kita mah biasa tinggal,4
katapat sekali laku silap sama hampir ciduk tahu mengapa jadi buat diri,4
senang bday dedek jiee adek nuna besar tetap jadi maknae sabar hadap laku abangny yah nuna syang jisung bahagia terus tenang jisung tetap jadi maknae kesaayangan pling kiyowok,2
hai kak hwii jangan skip breakfast yaasemoga hari jalan lancardimudahkan segala urusannyadijauhkan marabahayasemoga selalu dalam lindung tuhanjanlup vitamin yasemangat janlup senyum hihistay healthy selalu senang have great hari kak,2
pakai charming wangi tahan lama bahkan kalau kringetan wangi tambah nempel baju kalau freshy wangi bunga banget tidak suka bunga jadi charming worth coba buat,3
alhamdulillah yaallah kabar baik pagi jimin covid free,2
jangan keluh masalah datang hidup terkadang kamu rasa sakit dapat syukur bahagia,4
ada warning bodoh tikus just brushed past leg,0
fase begini tibatiba mood melownangispengen marah tidak bisagrutuntr pura pura biasa ajantr akhir ngomong terus capek baru biasa,5
kamu terburuburu baru avail bulan maret bulan terima hourly rent sila hubung ibunda saya jika yang kamu tanya wish kamu good hari sender,4
fav banget jelas payphone sisa semua lagu saya suka,3
thank kamu brill tidak nyangka bakal yang baca twittku wkwkw moga semangat laku apa kecuali scroll wkwkq,2
manajer kaya suka bikin planning benar walaupun sering banget patah sama ada stay strong,2
anak perempuan bapak suka bangun siang terus dibangunginnya perkara suruh makan tidak relate kalau juang sendiri lakilaki cinta penuh sama cinta pertama,3
hadeuh rakyat bodoh duble dong enak sampeyan gaji untuk penting tum partai,0
pak anis presiden insyaallah dukung karena rekam jejak beliau baik walaupun beliau pernah khianat beliau dendam balas kerja hasil baik bukan cuma omong doang bacot depan depan hati cerdas,0
hujan begini paling enak baca magangverse sesuai sama alur cerita yekan mana bulan februari latar cerita elaahh mas bii kiciww,2
rangkul pegang tangan saling tutup kasus korupsi semua senang,0
asa juga jadi bumerang diri sendiri nekat laku siap sama sekali teenzies mau kan terlontanglantung negara orang bekal sama sekali,1
sedih tinggal didik,5
suka malumaluin siapa nih kamu,4
makan nasi goreng pagi pagi emang paling enak,2
seru bnget bkin emosi,2
suka banget asli deh ungu ungu begini,3
moga jimin cepat pulih biar segara aktivitas biasa,4
jebal kajja sedih banget pas ngomong begitu,5
takut kecewa,1
kita ngabuburit muslim ramadan taiwan yukges,2
siapa yang allah hendak baik pada allah timpa musibah ujiancobaan pada hari bukhari,4
bodoh banget sih,0
bukan benci lebih tepat kecewa kemarin sih sekarang iya hari esok tidak tau biasa kecewa bawa kapan sih jadi silah bawa semua barangbarang ambil sisa sisa hadir yang sisa hanya kisah,5
suka banget rambut kuaci nya saya tau dapat darimana,3
wordle bodoh banget nebak huruf coba tiga,0
makin jeblok suara pdip jawa barat buat orang sunda semangkin benci,0
penontoon kok sepi sih tarak tarak tass,5
patrick wilson peran astronot john bradley whistleblower patut acung jempol totalitas akting soal kualitas saja akting halle berry jadi juara berkat profesionalitas jam terbang lebih lama,4
tidak ajar mulut manis muka lebih satu suka kata benci tunjuk sayang bukti saya bukan beri senyum kebhongan,4
galak banget diteriakin sama kating sini saking baik mulai apa tanya dulu apa kabar semalem tidur jam berapa sama katingnya,4
halah bacot mulu nih tua tolol jawab dulu orang panteis tuh seperti bagaimana erti panteis tidak nyontek gugel tuh bagaimana kok jauh banget uiugm kita bahas apa sih kok makin ngalor ngidul gegara kamu jangan baper gegara cewek viktor malu sama tytyd,0
mantan menteri didik budaya riset teknologi nadiem makarim resmi cegah pergi luar negeri jaksa agung jagung,4
kpk cegah orang luar negeri kait duga korupsi mesin edc bri,4
nah suka banget,3
rencana imbas imbis tok akhir bubar lah biasa dikei janji palsu,4
hmm romance sih soal genre paling aman benar general suka family tragedy kalau butuh itu lari film jarang lari because tend expect takut kecewananti jadi senang,1
pernah pas ngomong sama twice bilang temen suka sama exo nayeon goblog banget anjing exo mah grup exo bukan twice mana nayeon mangut mangut bangga,0
kamu takut tidak,1
filter orang orang toxic suka urus hidup orang parah banget ngeri,1
soumu bangsat,0
derang keluar kalimat minta maaf senarai alas bodoh macam biasa,0
bom pernah manggarai kalau naik kereta kaget jadi atas peron wkk,1
hah bodoh kali kau pantek,0
tahu fantasi campur telur biasa pakai putih telur soal,4
suka rebah ingin dapet cuan tambah banget sob yuk gabung sobat indihome sekarang dapat uang hingga ratus ribu rupiah modal smartphone kamu mana dan kapan,4
kak laraa cepat sembuh yallah sedih banget istirahat banyakbanyak,5
apa kabar cinta yang notabene cinta buku non fiksi,4
denise suara muu hcuwbxja tuhan sedih kamu keluar tidak-apa-apa ayokk banyak vid and debut wkwk,5
malu tuh,4
wahh semangat yaa,2
paling suka ghost banget hshdhdh gemes soal,3
banyak jabat publik sengaja laku korupsi bahkan sengaja ubah konstitusi rencana jahat halang atur hukum mereka bajing tulis tahun silam jadi relevan dengan kondisi sekarang,0
good pagi ganteng iya maaf baru bangun jadi bisa tani kamu sarap terimakasih loj buatin sarap enak banget apa buat ayang suka sih malu,3
kesal tidak apa,0
pas punya iya suka banget,3
pickaw sepi mulu,4
bikin emosi,0
sengaja biar soal takut langgar ham,1
bacot bangsat,0
muda sih tao cocok,4
awal badmoodd parahh habis dengerin langsung semangat,2
mungkin ikut pimpin pesantren cabul makanya bikin opini tolol,0
belum meraknyat belum ngapain menduniapujian luar negeri hina negeri swndiripak anies cinta rakyat cinta wargautamakan makmur damai kedaulatanngw suka gaya pak aniss,2
eps kesal gwinam ngapa die sih emang zombie immortal yak jatuh lantai bos apa shot gun baru die orang terus namra feel gwinam gwinam bisa tidak ngerti,0
kayak sepi apa lanjutin snowdrop dulu,4
masio jengkel maksimal tetap ditengahtengah kaki terus usaha imbang kamu did well sis keep goin cuma lebih objektif bijak jangan mau bodoh pihak hidup kamu hak bahagia jangan bahagia bikin orang bahagia,0
jangan nder juga suka keluar tengah malam terus foto kembang bagus banget soal pas lihat wkwk,2
yang emang bom tau banyak lah dunia rasa sedih marah tau deh rasa campur aduk saja ngetik nangisssss tau nyesekk bgtt rasa kalau yang hate komen begitu menang benar tidak suka saya sakit hati anjj,0
varian omicron milik karakteristik cepat tular gejala klinis lebih ringan bahkan gejala banding varian belum yang konfirmasi positif tetap tenang jangan panik selalu jaga prokes,4
ikan kilifish unik,4
micellar water malah mau buat bersihin kutek tolol banget berfikir kamu otak kecil,5
baru lihat,4
pagi ruby apa kabar,4
tiap pagi sedih,5
makanya yuyur kecewa biasa mhy pintar bikin baju bozz,5
hujan teruss enak,2
pura lah bodoh meski mnyakitkanjgan mndeskripsikn diri sbagai orang pandai ahlak pandai,4
enak pingsan kan anak sehat tubuh kuat,4
kejut tampa bangunin kamar sepi berangkat masjid sholikhah semu anak kembang,4
sahwa bang,0
capitano rela potong gaji tahan mil terlalu nawarin angka gaji baru emang suka banget manajemen sekarang lepas main jadi free,4
adil menang kata saja siapa tang perang akan jadi adil dofalmingo,4
source,0
lanjut bahlil yaa pak,0
daftar sekarang atau klik taut bio instagram saat wujud impi kerja luar negeri yuk pantau timelinenya,2
rejeki enzi anak imut pagipagi jajan yang ulang tahun wuhuu maaci iden moga bahagia celalu,2
sama mbak semangat pagi,2
anak susah makan kurus bunda jangan sedih mrpro atas masalah gngguan susah makan order bbmdcba,4
kalau bulan ginituh rasa deg degan takut sudah ketemu dedek sudah engap pen cepat cepat bobo telentang tengkurep,1
biasa pergi olahraga sendiri,4
hiih kamu ikhlas semangat proses semua,2
set skintific pcs set glowing acne baik barrier anti dark spot hydrating sunscreen tawar awat kulit komprehensif,4
mau nyemangatin orang saya sendiri tidak semangat aduh keenan bodoh banget haloo moots tetap semangat yaa luv kamu,0
hola kak wawa jangan skip breakfast yaasemoga hari jalan lancardimudahkan segala urusannyadijauhkan marabahayasemoga selalu dalam lindung tuhanjanlup vitamin yasemangat janlup senyum hihistay healthy selalu senang have great hari kak,2
kali suka banget sama layout nya,3
hilang saja,5
jual produk digital buat sekali cuan kali kali jual ide kreatif ajar jual produk digital hari klik taut,4
rahmat yasin portugal,4
aaaa habede eonnie selalu awet mudaa suka banget sama dan drakor pernah mainin sukses terus yaa eonnie,3
malu kali,1
allah kaget yaampun peluk cium muah love youuuu,3
suka banget style digi billa,3
suka kepipinan muda isi orang muda sayang join,5
lanjut gais bbc skincare produk lokal yang paling cinta demen karena tekstur creamnya lembut lengket aplikasiin muka ringan kaya pakai apa ngedempul kulit muka jadi cerah glowing natural,4
kalau pms sakit bel tidak mau minum obat takut gantung nyoba kompres pakai air hangat gaa tadi,1
rakyat ribut kemarin lalu dpr baru kaget sekarang gaji uang rakyat kemarin ngapain bukan dpr harus cek balances bikin eksmosi,0
takut takut,1
good pagi gita semangat buat streaming nya,2
satu sisi teriakteriak darurat pandemi sisi laku bodoh macam kasihan sekali nasib rakyat,0
kadang suka emosi baca begini orang goblog emang susah kalau ajak ngobrol,0
anjir anjir anjir sumpah sama pak hamba takut banget kalau suruh nungguin adek sendiri takut bangun terus cekek hamba,1
kabar baiik yey,2
salah bank kata bagi paperwork pakai letterhead firma kau bodoh bank pon kata kau cek bagi cust sign,0
baru kirim foto agropolis wonosalam,4
selamat pagi semangat olahraga,2
shoo senang meski rada kecewa sama durian rasa keluar budget banyak tidak worth tidak-apa-apa penting sama yakan,2
parah iya enak rebah cuy mbi lihat udan,4
jaksa yakin dakwa tiga korporasi sawit dakwa korupsi izin ekspor cpo bakal bukti bila ada suap tiga hakim adil perkara,4
terus ujar apa ujar bangsat ujar kunyuk,0
teman smartfren biar makin semangat lihat kucing lucu gemesin banget kak terima kasihalin,4
monster hunter mungkin menang telak bicara sensasi buru puas ramu equipment ada cerita tentu emotional buildup buat god eater punya nilai lebih simpel tarung alas sembari paham alas sendiri,4
krystal suka banget sama masakan tradisional nya mexico burrito,3
semangat trisya senang weekend,2
benci banget dengerin lagu bucin,0
semangat diri takut tetap juang,2
malu,4
huhu sedih banget mana,5
saya tau sedih tertawa semangat mbarnim moga kembali hubung,5
jurnalpatrolinews jakarta komisi berantas korupsi kpk jadwal periksa dua individu sektor swasta rangka lidi duga gratifikasi ada barang jasa majelis musyawarat rakyat mpr,4
samasama tidak suka pilihpilih makan kaya nina kasih makan banyak dia gembul lucu,3
bobby nasution diperiska duga korupsi jalan sumut maki ancam gugat kpk,0
semua cewek suka cowok ganteng kadang juga cewek suka cowok ganteng banget,3
hari tidak dlngeri,1
makanya fanatik sama politis bro hingga nilai obyektifdikira benci rakyat biasa brojd politis dukung politis yang cuma mentingin pribadigolongannya,4
nak kongsi dekat korang kami ada buka booth jual merch singgah cuci mata tengok tengok fizikal zine lokal jual rantai art acara week myground mytown shopping centre february,4
alhamdulillah jimin pagi kabar baikk,2
sudah dewasa sudah kecewa,5
mun lah versi bila jadi mantan dapat barang mantan mun dasar suka tepakai pakai tarus ingat barang nya sih orang nya bari siapa kda peduli wkwk pakai barang bari nya bukan arti masih cinta kalau,4
