Tweet,label_encoded
mau nang yedam sunu did bener nyangka sama sekali dapet hasil gin memang uas kemarin hopeless banget takut sesuai harap bikin orangtua kecewa,5
jombang khofifah sampai siap panggil kpk meski sempat tunda,4
takut,1
balas dendam aowkwowkw,2
hari dapat kabar bahagia masyaallah alhamdulillah,2
hancur negara,5
kala banyak gera kabur tinggal negara lahir beberapa anak muda pilih tetap lawan sistem perintah bobrok,3
bagaimana makin sayang brti orang apresiasi karya bukan lewat jual album dia juga tau kalau album fisik nct emang paling bikin melarat wqwq taun normal album jenis per unit unit bom project besar nya wqwq,4
joonyong sedih bgtt cibee kajaa,5
sehat nikmat luar biasa yuk gerak biar sehat,4
kalau peluk yang marah,4
baru kirim foto bekas,4
rep bro takut sesal belakang,1
sedih baca,5
parfum junkyu waktu lihat teel banyak suka beli parfum jadi kepo kann nyata saldo spay cukup orang baik mau coin parfum senang wangi enak banget mohon,3
wihh semangat pkl nya onad sarap lums kalau lums sarap dulu yaa have nice hari stay healthy,2
banyak orang dengerin lagu kaya begini yaa salah satu utopia ingat kenang jalan cinta tetapi tidak suatu lirik wakil strategi buah korporasi lagu buat sedih dengar toxicity sod selalu ingat almarhum teman udahh,5
pagi pagi emosi gara gara baca,0
semangat soal ayang nyemangatin sial kamu idang,0
lagunyaa monyet sedih banget,5
elanga jan sedih,5
pakai ikut kaget segala,4
kayak bakal enak banget,4
cok pagi pagi buat emosi,0
jangan rakyat benci,0
pagi sudah emosi,0
terus makan dibawain minum dibilangin pakai yang biar enak inti terus ngomong henti sudah nahan nang rasa salah jutekin,5
punya rencana lanjut studi amp tahun coba apply beasiswa internasional yang wajib pulang indonesia deh beasiswa incar,2
duga korupsi proyek jalan bestie bobby nasut,4
semangat buat hari kamu deserve senang anw jangan lupa sarap ola,2
perahu sedia payung sudah sedia tunggu hujan langit apa macam mak aji sayang oii,4
mohon sedih bangett,5
lihat yakin sakit suatu kau ingat entah orang bodoh hasil kau tipuatau orang baik kau sia sia kan,5
kalau mending golput ngapain pilih wakil rakyat percuma,4
sedih mulu,5
pernah nih dapet cerita soal begini mulut anak cowok langsung diginiin tuh anak cewek betul emang terlalu sukain sama anak kelas tidak suka sama nih cewek laku begitu terlalu banget saya denger cerita,0
oalah pagi bikin emosi,0
bukan player biasa biasa guna pro player pon guna halahh halahh,4
sepi banget,4
sedih masih sakit padahal semalem minum obat,5
suka loh sama kamu kapan ketemu sayang,3
lepas hati pikir ikat jadi mudah marah kecil hati,0
makin banyak orang tolol asu goblok,0
haloow ajaa baru temu sekomplek cubang greget banget kigen tuh suka sama dika jadi ikut galau weh menur halo anon tidak kokk emang biasa update weekend hehe tha,3
emang gituu juga greget gemes soft banget kalau lihat filmdramanya kaget keren ituu,2
mau duluin asa sendiri takut kecewa,1
sumedang jaksa negeri kajari sumedang ungkap duga tindak pidana korupsi manfaat kayu kelola hasil tebang kayu lahan izin pinjam pakai kawasan hutan ippkh dampak bangun jalan tol cisumdawu perkara sebut,4
kadang suka berfikir ada orang mama mertua toxic banget suka adu domba beliau pernah benci kalau punya uang beliau suka pakai buat beli makan satu keluarga rasa mau bikin nang gimanapun beliau tetp sayang,3
dekap sepi sudut sunyi simpul tali ikat diksi gapai rindu cabik pilu hati selalu ukir nama ilu,5
sedih melulu,5
enak banget kayak maret uts tbl tbl,2
kau pernah rancang jatuh orang kau benci perempuan kah,0
haalooww bocil sunuu selamat hari sabtuu selamat weekend jangan lupa senyum bahagia selalu hari jangan lupa sarap terus minum air putih banyak biar kuat have wonderful hari todayy,2
harga orang cinta saat telah pergi dari sesal yang sisa,4
benar banget ngomong ngomong beliau kan salaf yak jadi ajar nya keras banget sesuai tuntun alquran hadist emang banyak banget suka fitnah beliau,4
mesti mirip sama wajib juga sih kalau bilang mesti kalau emang mesti yang maaf bisa punya turun bagaimana senua gantung niat awal meni niatin buat ibadah kalau diniatin nya mau punya anak pasti kecewa kalau kasih jadi was,5
iya tetapi tau efek soal biasa pakai yang ini kak,4
cuti habis semua back normal,4
kalau hockey summer lihat lah seperti pas oper oper pucknya tuh bisa ngepas mana kan lari sana sini lihat takut kepleset,1
minta nak makan macam minta suami minta orang suruh beli pulak bodoh,0
jurnalpatrolinews jakarta komisi berantas korupsi kpk aktif laku sisir jumlah lokasi duga simpan bukti perkara duga suap kait proyek infrastruktur jalan libat dinas kerja umum tata,4
kapan coba bisa kaya temen berani deketin cowok yang dia suka duluan banget dekat sama crush jadi temen dekat deh,3
aowkowkwok mau sedih sudah biasa jadi tertawa,2
lahya ngapain marah wkwk,2
pernah sih kamu iseng nyanyi nih depan pasang asal nyanyi bnran nyanyi terus pasang kamu kesima kaget shock lalu bilang lah baru tau trnyta suara kamu bagus literally emang tidak pernah nyanyi pas sama pasang malu geys,1
pindah alhamdulillahga jadi pindah alhamdillah ada pengaruh sytetap nyari rejeki sendiri halal keluarga harus iba jilat adu domba antar sama anak bangsa pesan simbah ojo ela eluojo gumunanojo mateni rejekine wong liyo,4
apa suara niji enak banget allah sanji mengmaaf gonggong buat niji dulu,2
aduh moga semua baikbaik,1
sedih tangan ayang buntung,5
pilih kontroversi macam nak suruh orang benci,0
tolol dna nya orang,0
jibe kajja lah sedih banget bye nang rooftop sedih,5
yuuta semangat senda,2
gud pagi selamat pagi ceria sehat selalu,2
daftar diri kaka buat raih sempat menang puluh juta cukup modal daftar pakai rekening apa pungut biaya admin daftar klik taut sini,4
biasa didamel teh nafkah diri sendiri,4
agan agan pada nyobain nih pempek kapal selam joeragandibuat ikan tenggiri segarenak loh,2
kaya bakal kasih apa orang tapi jarang banget jadi soal kan gemini suka main main jadi jarang banget tuh mau serius wkwk,2
bukan jadi mangsa maki kena marah but concerned pasal cakap tetiba,0
baru tapak kaki ujung terminal pukul enam pagi taksi pes diri menimbangnimbang arah tuju dua kaki gerak ujung tumit ulang kali,4
ihh enak banget buryam tidak suka masalah apa anw selamat mam ayang,3
silibus memang kbat gila babi bodoh buat silibus learning should fun,0
alas suka banget sama karya kak kadang bikin salting sendiri kena banget meski gapunya ayang,3
kaget jilat,1
biar hujan urai rindu tidak pekat salah campur rindu sepi hingga kecap pahit nelangsa,5
paling agak cacat sedikit wkwk,2
tugas jokowi,0
mriyang kudu tetap kerja bisa bahagia duit miris sedih,5
mimpi koq bikin emosi orang bikin lapar pokok maadyaaaaang sugeng enjing senang weekend,0
kalau lagi marah omong pedas banget suka banting barang apa yang dekat,1
sekali bahlil dong pak,0
tidak keluar suka banget muka jadi bersih huhu,3
kalau bener semua takut,1
tau kalau orang manggil dengan sebut cece suka banget,3
ship both tho kalau gatekeeping tolol,0
seperti mati rasa deng bukan mati rasa cuma move makanya bikin baper baper baper awal tinggi terus skrang jatuh rasa sedih,4
ramai tagar istana kalau mau rantau punya skill,4
ganggu banget bikin risih resign jadi padahal suka kerja,5
sudah pernah tonton kisah ini belum saya benci endingnya,0
kamu gembira gembira lampau hakmuketika kamu kuasa kamu ambil yang bukan hak adab orang iman,4
laku temenku tuh suka begitu bilang jalan tau tau lama banget,0
tren luhut perlu buruburu spekulasi,4
cegah laku dukung lancar proses sidi duga korupsi ada laptop chromebook kemendikbud ristek periode tel anggar hampir rupiah triliun,4
temen yang lockey bilang begini belum kalau coba group tidak ikut mungkin bias tidak lanjut sana yaallah sedih,5
ahh yang tau exo tapi suka kpop sukaknya baru sekarang tahun hiatuswlapun hiatus ttp cinta krena sllu tau jadi poin mereka terus mkin kepo makin saya cinta sayang bngetexo saranghajaa,3
lebih pertamina sudah hampir pernah orgasme berahi korup,0
kalau biasa biasa sudah,4
sore sore harus tenang malah degan gegara dikagetin jelas,1
benci jangan bodoh,0
anjing baru nonton all dead bawa emosi bgst,0
ngezoom banget gambar kaget,1
kalau komik begini jarang sad ending biasa konflik banyak akhir bahagia beda kalau masuk drama biasa kbnyakan sad ending,4
semangat vii,2
hufftt bismillah bismillah moga kuman dina nik periksane panik mik panik katah sholawat mawon,1
sekarang normal deng,4
sekolah gais tanggal bisa unggah foto kann tadi pagi unggah foto pas loading malah error mohon notice sender panik banget nihh servernya error,1
juga tadi salah nder jawab bomat who cares biarin ajaa lagi kamu hebat mau berani jawab tanya guru jadi usah malu nder,4
baru kirim video nagari durian tinggi kapur,4
orang islam butuh orang bodoh,4
hatihati akun palsu mengatasnamakan bank mandiri minta data rahasia informasi kait produk promo tarik bank mandiri ibu chat mita whatsapp official tetap jaga sehat selalu tkswilsa end,4
semalem mimpi orang sudah lama kontak tiba tiba kirim pesan pas bangun nge cek nyata ada pemberitahuan apa apa sedih banget,5
makan bang jangan marah sedih kalah,0
apa harus mute word sedih hemat penven jajan,5
suka banget sini,3
ahahhah iya sama bayangin sudah beli terus kaget belakang nyatu terus tangis semua,1
bahagia bangett,2
umur sekarang sama kamu nder dekat sama cowok akhir tuh tahun lalu kayak sekarang pernah yang deketin wkwk paling sedih kata perawan tua,5
alhamdulillah pagipagi dapet kabar baik soo happyy yayy ayang jimin sembuhh tinggal pulih habis operasi nya,2
tas hampers lebaran,4
jangan pernah benci sama orang saja jodoh kam,1
ahahaaa khas buzzerp jokowi nuduh orang mau tuduh marah,0
jurnalpatrolinews jakarta sidi atas duga korupsi proyek digitalisasi didik lingkung menteri didik budaya riset teknologi,4
kaget heran akhh,1
buat salah jngan keluh jangan marah ajar salah kemudian coba dengan cara beda,4
baru mau senang saja hambat apa mungkin hidup boleh bahagia,2
tembus interview susah dapet offering letter lebih susah makin sini makin yakin buat,5
aneh kok harus aneh apa kalau sekal mau coba nderr nebeng sama temen kalau pada mau nonton kalau tidak apa chill santai wilayah tidak bioskop isokay kincana kok,4
tagar warning negara salah urus nasib masa depan anakanak bangsa potensial talenta,1
mau bar bar agak takut kak,1
sekarang masih sedih bakal nang kalau baca lirik serelate sama hidup banyak orang karya tulis mark beneran bagus banget dari segi vocal rap semua dia lakuin bener keren banget bikin bangga sama mark huhu ily,3
baju hilang laundryan pagi bikin emosi,0
nempel banget kalian padahal ngobrol tinggal ngobrol harus bisik segala kan suka jadi,3
makasii kamu semangat yaa,2
fauzan dengar murka sang ayah diri utara mimpi rasa kecewa pikir diri akan suruh ikut ego sang ayah kakak ronan patah mimpi jadi orang musik,4
jimin tetap banyak istirahat minum obat makan sehat hari sayang tetap miss kamu jadi bad but juga harap kamu lekas pulih bisa jalan aktivitas biasa,4
senang ulang tahun sender wish kamu all the best senang besok gilir hari tetapi tidak yang ucap tidak-apa-apa biasa,2
berani nyuru jokowi turun mobil datang suatu tempat tidak jadi kerumun mereka tidak mampu padahal lebih mudah cuma satu orang larang,4
senang banget pagipagi kabar bagus begini syukur jiminnya army sembuh sehat selalu jimin,2
korupsi sakit akar rugi banyak orang awal paling atas terus tiru bawah akhir anggap buruk lumrah membantas koruptor seperti buah cerita rakyat negeri,5
dulu sekolah emang banyak banget suka sama sih tambah juga tidak cantik,5
punya ingin besar buat hidup balas dendam makanya tetap hidup meski tengah zombi,4
kalau bad hari sangat tidak hak nak emosi kat orang tidak professional,0
suka banget,3
kenal ausbildung jerman berkarir tetap jerman cek out situs,4
hari masih yang menang moga tangis bukan tangis sedih,4
buka mungkin habis imlek mau order roti srikaya dulu buat ngopi sisa pandan jadi sedih lain sold,5
idm selamat pagi senang banget dapet kabar jiminie hari buat kalian sehat terus yaa jangan lupa sarap,2
korupsi proyek jalur mantan dirjen perkeretaapian tuntut tahun penjara,4
baik noel tanya mas broo kabur jordan mau lagi indonesia apa jordania mengapa kabur kalau rasa nyaman tinggal dan hadap perlu,0
fenomena bentuk ekspresi generasi muda justru tunjuk peduli masa depan bangsa,4
jangan toleh belakang lihat depan coba baik kau ubah nasib,4
lupa berapa banyak lulus universitas tahun lebih penting tuju belum dampak baik seluruh masyarakat jangan heran kerapkali berseiweran ting bahkan,5
adik kandung prabowo aku terima lapor korupsi mbg hari,4
pindah dokter cowok usia sampai sekarang sama dokter yaa ada tuh judge itu support habis abis apa putus ibu soal kembang solutif soal makan solutifnya luar biasa emaknya keluar ruang dokter muka senang dapat solusi,4
wkwkwakw kambing marah,2
tidak berfikir kesana bang,0
aduh bagaimana,1
bukan pens emyu nama kalau ikut tolol,0
yang mulai sebar bacot pesan prabowo seluruh kader gerindra jangan jauhjauh ulama,0
papa nya kabar sih lapar belum suruh makan sama ayang,5
apa romance kalau horror jangan hantu mun takut sama hantu,1
eiyy repott seriuss duariuss deh apa tidak buat daraa soo jangan sedih yaa ada kok mau baca cerita kamuu,4
dokter ngomongin pola pikir sama treatmentnya belah mana mati semua idup ngomong ortu bahagia matikarna ikhlas saya ngajak debat biar pro perintah najis reply saya baca yang gagal tangan pandemic indonesia cma indonesia,0
saya tertawa banget lihat komennya kamu bedain mana dekat sama kamu kata exo temenan cuma satu tahun tahun tidak anjr wkwk suka duka lewatin sama ngejokes biasa lah notabenya baru kenal sudah sokap lollu pikir sendiri apa beda,2
allah enak banget libur ngomong ngomong bulan saya cek out shopee isi bantal sama blender jus mau baik kualitas bobok sama sehat wkwk saran dokter habis kontrol sumpah rekor bhakk makanya beban badan makin berat shay,2
biasa banyak lebih tua manggil saya ada santai klopun orang bilang punya adek arti saudara kandung lebih muda dia mau umur berapa,4
ngulet kasur enak banget wkwk,2
sedih tidak kawan,5
nona pera cinta cipta buah rasa tumbuh bebas seperti biasa tulis kumpul aksara bagai frasa tanda dia ramu cinta,3
lulu bggtt cinta bgtt mana suka sayur brokoli lucu bgtt gemess selalu kepo endus,3
harus tadi beli lupa nama banyakin soalnha enak,5
wakil hati rakyat indonesia,3
berkoarkoar saja seperti begini sumpal pakai duit diem masuk ngamukngamuk sebut jin buang anak jin nya tidak marah kokyg manusia ngamukngamuk sadar kalian sudah provokasi woii kampung juga tempat sebut,0
bener sering banget berfikir kaya begini terus kalau lihat muka emak pas tidur langsung banjir banget kaya capek mah suka tiba nang lihat mamah diem sampai bilang senyum mamah ada semua baik baik tiap kalau mau nyerah,5
indonesia kian untung usai tren seru,2
jurnalpatrolinews jakarta jaksa agung lalu tim sidik bawah direktorat sidi jaksa agung muda tindak pidana khusus jam pidsus periksa enam orang saksi duga milik kait perkara korupsi,4
sombong soal wamenaker kabur saja kalau perlu jangan balik klik baca kompascom baca berita iklan download aplikasi,0
kata motivasi ibu buat nama hidup bahagia terus jadi kalau masalah sudah lumrah jadi adek jangan sedih lama lama hari baru dapet musalah tidak papa yang penting sabar tetap syukur bisa ngelewatinnyaa,4
amplsquokabur duluamprsquo gema medsos begini pujapuji jusuf kalla warga tiongkok hingga misi negeri sakura angkut tenaga kerja idonesia kerja keras,4
ojo lali ngemil ceria,2
mimi cowoku pulang keren its good berita start exhausting dayy beyond proud kamu bisa lewat semua sakit mimi lets pakai another senang memories laughing out loud saya sayang bgtt sama kamu kamu harus bahagia sehat selalu,3
ngeri sekarang kantor sisi tipi bisa ngomong,1
jadi tonton barang sita korupsi bukan pamer kuasa strategi visual punya pesan jelas hukum bisa beli ada kebal hukum dapat insight bisnis amp ebook gratis komunitas consumeri,2
malu banget makxskxj mau pacar sama hyomin anjay,1
terus harus bayar kalau beban saya maklum kalau sebut tagih benar,4
budaya keluh jangan semangat,5
bodoh punya orang doa makan kau beli jatuh burai sempt kau masuk mulut amin,0
rasa cringe banget anjir kemarin mau ngetik kak tuh nya suka hilang jadi emang sama kan kesan baku banget saya ngetik kakak singkat jadi hehe kocak and tertawa deh pokknya,2
haha semangat kerja ssyangku pulang tiati yaa,2
adaa yang pancing emosi pagi,0
kelon enak hun,2
kamu deserve suka banget sama karyakaryanya kakak bagus sekali,3
boy william nih suka banget lihat cara ngomong lihat pintar tidak arogan,3
semangat buat hari kamu deserve senang anw jangan lupa sarap sebb,2
sumpah kalau galau malah dengerin lagu hiphoprock kalau lagu galau malah biasa,4
cinta suka berlamalama sedih just move,2
sekolah biasa ramai ramai makhluk kasat mata wkwkwk bikin merinding,1
sama nder tahun pernah tembak dekat sama cowok juga pernah sejombloanya temen mereka masih yang suka pernah rasa suka orang jadi pure jomblo bodoh sih mau ada pacar tidak soal biasa sendiri jadi finea,4
jangan marah,0
baru kirim foto jayapura indonesia,4
sedih bngett lihat xiaojun minta maaf krena wayv bisa coba,5
soal wamenaker kabur saja kalau perlu jangan balik,0
klik pesan ayam bakar lewat,4
ada cara moga sukses,5
kalau suka lauren layne samantha chase banget ngobrol,4
ngeri banget temenmu nder,1
suka banget sama foto bang jhope ini tysm tidak wish luck,3
ramai jepang minta warga kerja negara,2
bismillah yuk semangat pagi,2
sedih banget progja selesai semuaa hwaa mau udahan kknnya,5
jangan biar satu yang bodoh ngehancurin bahagia kamu hari,0
heran kaget ngomong,4
lupa kawanon waktu bukan budaya saya gtuklo ontime hati gelisahpas ontime sepi,4
bro its real,4
ermm macam berat ilmu takut capai ikut ada ilmu silat,1
dong paling suka favorit banget tuh some malam terus dua siren duh unnie cantik banget highlight lagu enak aah makin sabar cold hell juga keren habis proud kamu unnie,3
alhamdulillah pakai kerudung ingin sendiri justru malah malu pakai baju haram,2
jijik sekali kesel marah sedih takut ngerrriii arghhh,1
anjing emang baim mana baim rada tau kamu bangsat emang kamu sibuk gabut sebut oknum digibahin iya gibahin cuma allah wkwkw mbabung kamu frik,0
bmkg prakira hujan ringan potensi jadi jumlah kota besar indonesia,4
punya bom nuklir amp ada korupsi,2
trivia being deadass tidak pernah dugem wkwk takut ngebungkus laki orang,1
salam phia kenal gading baskara gading biasa sapa ada agenda apa akhir pekan,4
moga capai kak semangat temennya,2
dohoon pernah dekat nadi kalau harubby bener nyatu kalau dohooniest selalu bilang dohoon punah bahkan cinta harubby bilang harubby kan saling kenal lucukk banget kaku makanya suka lihat harubby kalau paksa dua,3
kalau tbtb kata mbak nya bilang mau putus sekolah seperti nya bukan mak saja marahh bapak juga lebih marah jangan lupa tetangga pasti ikut gonjang ganjing atas hidup wkwk,0
bismillah desiliun takut berat hisab,1
kalau teman abg murung pagi pasti fans wkkwkwkwkwkwkw,2
baru bangun rumah sepi tau mana jadi sepi,5
ekspektasi banding lurus rasa kecewa,5
tau deh biasa searching search bar,4
temanteman mau kasih informasi bawa pulang kucing karena dokter tidak petshopnya takut kucing stress jadi bawa pulang dulu kalau dokter ada tempat bawa kesana,1
kalian kadang bingung sih kalau ajak keluar outfitnya pakai apa padahal yang ngajak teman biasa,4
kompak niyee kaget heran geram tidak asing telinga,1
lah mah kesntuh semua saraf stres sedih marah frustasi cemas mual tegang langsung bablas hilang mana cantik banget genggam,4
kpk tetap kad pupr sumut sangka korupsi proyek jalan,4
temu menfess saya banget ragu mau rep,1
baru bangun kena marah tiba tiba but should keep kiyowo,0
kemarin kecewa dukung tps kinisemua buka jati diri benar,5
kaget nikah bagus walaupun sedikit bagaimana okee besokbesok nonton wetv,4
enak,4
wamenaker immanuel ebenezer tanggap santai tren tagar media sosial dorong wni kerja luar negeri noel sapa akrab bahkan sila yang pergi tidak indonesia,0
suka banget kalau pasar daerah pasar ada dekat komplek pasar jauh nama pasar induk nenek suka ngajak kesanah naik angkot kan seru jadi suka ngikutt,3
aneh banget bodoh kamu,0
assalammualaikum jangan lupa bahagia pagi nikmat kopi meski kopi pahit dengar musik classic rock bila engkau izin hengky supit cover byobay kusut,4
susah ajak cerita anak lebih suka dengerin cerita orang jadi dia bakal ovt keluh apa twitter nya dia rasa lebih nyaman cerita priv orang walaupun bakal lihat sama orang,4
semangat tetap sehatt,2
only start filming jangan know kapan airing biasa kan cdrama kalau tahun sah,4
jiahaha biasa curhat cewek dimedsos kasihan istri tanggung malu kampung,1
kaget tidak banget,0
emosi akan bimbing suatu pikir tindak positif sebab kamu tenang teenspaulina,4
kaule dados bruder makane digodha nben lepas jubahe tetap semangat brud,2
masalah apa tigrealnya bagai user tigreal malu banget,1
jadi biasa terlalu biasa,4
enak banget pagi pagi bisa berak,2
juga dibebasin dulu sama bapak mau main jam berapa kalau pagi tau diri bapak marah was wos diem mending ingat sekarang tau ada tempat yang aman buat kaum hawa,0
aduh tolol wkakkwkak,2
paling bahagia turut saat tidur,2
exol juara malumaluin fandom sendiri,4
jangan pernah beri orang harap kamu ingin penuh lebih baik jujur meski pilu pada bahagia palsu,4
kau benci sangat siel ngan,0
hari pakai baju pink sama celana item takut dikatain blackpink,1
kalau interaksi sama tidak deg-degan berat bukan suka cuma nyaman aman sama anjay wkwkwkwk,3
bawa mimpi sedih sama cewenya pen lihat bahagia,5
iya rupa enak cosplay jadi nasa,2
mungkin orang beda kali yatapi kalok pribadi suka banget kalok yang minta maaf pakai surat kesan manis banget bahkan semua temenku tau trik jitu banget jan lupa kasik surat sama cokelat hitung nyogok serius deh itu manis banget bikin jatuh cinta,3
pagi pagi ada yang enak badan kabar baik banget alhamdulillah jimin sembuhh,2
bukan emosi mbak bikin emosi,0
kicep takut tau mungkin,1
jepang baca rambu jalan masih nebaknebak buku ajar kanji bonus langsung praktik kalimat asli jadi pas kabur beneran cuma sumimasen yuk amanin buku dulu,2
selamat pagi first people mohon maaf atas ketidaknyamanannya cek modem area normal mohon bypass guna kabel lan modem device kemudian akses situs detikdotcom youtubedotcom bila mohon konfirmasi terimakasih sita,4
sedih banget pulsa,5
pagi ngomong ngomong cuaca enak begini mending tidur yok have nice weekend,2
biasa srpan raa,4
mimpi temu collect book pas banget suka pas bangun lupa bentuk,3
bukan cinta suka lebih persaudaran sempat jalin jangan lepas saja masih ingat lupa baik tunggu salatiga meski tidak pernah kontakaan moga kamu baca,4
paling benci kalau emak bapak ngomongin jodoh fuckin,0
jabat kaget budaya kumpul orang bodoh main drama prestasi jilat korup kira,0
lah lah kaget dong kok kamu malah sedih,1
takut dewasa,1
ntu kecoak jijel takut,1
orang indonesia bukan arab negara kafir bangga agama islam warga negara kafir sendiri bal bal nya malah hina orang indonesia kadrun munafik,0
kabar kalau smt masih tuweb nder upbjj pasti,4
kak kay maaf telat makasii banyakbanyak kak buat ganya youtube premium aman kendali telat bangett padahal dari hari lalu premium huhu maaf kak serius enak nonton iklan tuh makasii kakk,2
orang dapat malu suatu temu vote the,4
cinta jangan pernah tinggal orang kamu cinta untuk orang kamu pikir kamu suka,4
halah ngaku usah malumalu dasar munafik,0
sek pagi emosi udaah mau hari bisa login,0
karena kadal gurun hidup brutal rusuh muka jauh begitu dideketin tengok langsung lari tersilit cari lobang semesta mau kiamat itu laku terus terus lama hidup,4
kalau tae nge post ulang foto diledekin seokjin get tae itu sedih banget buat kamu,5
tetap jadi orang bahagia setan datang asa tekan sedih nice quotes guru mamih satu mih tetap lah trsenyum mskpn anggap gemblungsebab senyum adlh sbgian ibadah hal paling benci orang tidak suka,4
makan mie tempat biasa ibu belanja,4
moga hihi terima kasih banyak lisa lagu bucin pokok wkwk cewek selalu mau habis waktu sama orang spesial dia suka,2
jdndhdjh jujur yaa suka covernya takut banget baca makanya beli,1
jumat tes hasil negatif santai senin sidang offline ketemu banyak orang malam selasa ngurung diri kamar rabu sore akhir pergi rumah temen mau ambil barang banyak banget pulang malam hehe,4
aaa beneran suka sama ini awal tau grgr teman sma kelas terus penasaran ketemu prelovednya seru banget pokok gemes sama bungsuu,3
tertawa sama sedih anjr nonton inituh kawkwakwakawawk,2
ngeri angine soalna jeng wkwk takut sakit,1
ngerti sama atur kerumun kena sanksi cuma denda yang kena yang plus penjara bulanah sudah capek sama yang begini maaf yang bodoh dungu,5
sinyal buruk masa depan indonesia emas,1
selamat ulang tahun jisung moga kamu selalu keliling orangorang baik selalu beri sehat semangat coba nya yaa,2
suka beli notes gemes habis tidak pakai sayang,3
itu ini belut sudah jadi cemilan kembang beberapa umkm lho wah keren banget kan paling suka makan hidang apa nih belut,2
selalu jadi piala keluarga kadang jatuh bawah sementara tetap semangat mafa,2
kembali priyadi,4
mimpi qasim nabi muhammad saw sabda adalah islam dan rana qasim laku segala rana allah kata allah beri pahala lipat ganda ramai muslim seluruh dunia dakwa adalah imam almahdi dia tolak,4
bisik ingat potong kecewa tidak kunjung usai balut luka tidak kunjung obat luka luka luka tutup dengan luka sedikit selip rasa salah tolak aku,5
pernah minta nebeng emang ditawarin dan tidak enak soal waktu ada temen cerita sebel banget minta ditebengin mulu mentang arah jadi suka pikir kalau nebeng berat apa enggak,1
paling nyeremin pas razia dada pas lagi bawa bedak tbs tentu murah panik kalau bakal sita kalau misal iya sudi sih kalau dibalikin untung tidak tau,1
jgan balas dendam yaa,4
apa enak banget fess,2
selalu pilih sabar marah syukur ingkar bahkan situasi memang sakit jadi tetap baik sana orangorang sabar syukur ingat halhal baik banding sakit,4
sekarang tanya tanya orang suka banget buat sampah halaman rumah yaa sedih bersihin terus,5
